"No.","Time","Source","Destination","Protocol","Length","Info"
"1","0.000000","192.168.5.64","192.168.5.93","S7COMM-PLUS","119"," > 4611 Ver:[V3] Seq=4082 [Res SetVariable] Retval=OK"
"2","0.000009","192.168.5.64","192.168.5.93","TCP","119","[TCP Retransmission] 102  >  4611 [PSH, ACK] Seq=1 Ack=1 Win=8192 Len=65"
"3","0.000732","192.168.5.93","192.168.5.64","TCP","54","4611  >  102 [ACK] Seq=1 Ack=66 Win=63768 Len=0"
"4","0.001831","192.168.5.101","192.168.5.93","TLSv1.2","97","Application Data"
"5","0.001832","192.168.5.101","192.168.5.93","TCP","97","[TCP Retransmission] 62762  >  3389 [PSH, ACK] Seq=1 Ack=1 Win=8210 Len=43"
"6","0.001832","192.168.5.93","192.168.5.64","TCP","60","[TCP Dup ACK 3#1] 4611  >  102 [ACK] Seq=1 Ack=66 Win=63768 Len=0"
"7","0.002013","192.168.5.93","192.168.5.64","COTP","61","DT TPDU (0) [COTP fragment, 0 bytes]"
"8","0.002018","192.168.5.93","192.168.5.101","TCP","66","3389  >  62762 [ACK] Seq=1 Ack=44 Win=63628 Len=0 SLE=1 SRE=44"
"9","0.002178","192.168.5.63","192.168.5.62","S7COMM","76","ROSCTR:[Ack_Data] Function:[Write Var]"
"10","0.002179","192.168.5.63","192.168.5.62","TCP","76","[TCP Retransmission] 102  >  59284 [PSH, ACK] Seq=1 Ack=1 Win=8192 Len=22"
"11","0.002180","192.168.5.93","192.168.5.64","TCP","61","[TCP Retransmission] 4611  >  102 [PSH, ACK] Seq=1 Ack=66 Win=63768 Len=7"
"12","0.002180","192.168.5.93","192.168.5.101","TCP","66","[TCP Dup ACK 8#1] 3389  >  62762 [ACK] Seq=1 Ack=44 Win=63628 Len=0 SLE=1 SRE=44"
"13","0.008863","192.168.5.101","192.168.5.93","TLSv1.2","97","Application Data"
"14","0.008863","192.168.5.101","192.168.5.93","TCP","97","[TCP Retransmission] 62762  >  3389 [PSH, ACK] Seq=44 Ack=1 Win=8210 Len=43"
"15","0.008922","192.168.5.93","192.168.5.101","TCP","66","3389  >  62762 [ACK] Seq=1 Ack=87 Win=63585 Len=0 SLE=44 SRE=87"
"16","0.009056","192.168.5.93","192.168.5.101","TCP","66","[TCP Dup ACK 15#1] 3389  >  62762 [ACK] Seq=1 Ack=87 Win=63585 Len=0 SLE=44 SRE=87"
"17","0.011852","192.168.5.64","192.168.5.93","TCP","60","102  >  4611 [ACK] Seq=66 Ack=8 Win=8189 Len=0"
"18","0.011853","192.168.5.64","192.168.5.93","TCP","60","[TCP Dup ACK 17#1] 102  >  4611 [ACK] Seq=66 Ack=8 Win=8189 Len=0"
"19","0.022909","192.168.5.64","192.168.5.93","S7COMM-PLUS","328"," > 4611 Ver:[V3] [Notification] ObjId=DynObjX7.64.504 Ctick=0 NSeq=5511 ChngCnt=1 <Contains values>"
"20","0.022911","192.168.5.64","192.168.5.93","TCP","328","[TCP Retransmission] 102  >  4611 [PSH, ACK] Seq=66 Ack=8 Win=8192 Len=274"
"21","0.023617","192.168.5.93","192.168.5.64","TCP","54","4611  >  102 [ACK] Seq=8 Ack=340 Win=63494 Len=0"
"22","0.024890","192.168.5.93","192.168.5.64","TCP","60","[TCP Dup ACK 21#1] 4611  >  102 [ACK] Seq=8 Ack=340 Win=63494 Len=0"
"23","0.025176","192.168.5.93","192.168.5.64","COTP","61","DT TPDU (0) [COTP fragment, 0 bytes]"
"24","0.025348","192.168.5.93","192.168.5.64","TCP","61","[TCP Retransmission] 4611  >  102 [PSH, ACK] Seq=8 Ack=340 Win=63494 Len=7"
"25","0.043065","192.168.5.62","192.168.5.63","S7COMM","85","ROSCTR:[Job     ] Function:[Read Var]"
"26","0.043066","192.168.5.62","192.168.5.63","TCP","85","[TCP Retransmission] 59284  >  102 [PSH, ACK] Seq=1 Ack=23 Win=8192 Len=31"
"27","0.049642","192.168.5.63","192.168.5.62","S7COMM","83","ROSCTR:[Ack_Data] Function:[Read Var]"
"28","0.049643","192.168.5.63","192.168.5.62","TCP","83","[TCP Retransmission] 102  >  59284 [PSH, ACK] Seq=23 Ack=32 Win=8192 Len=29"
"29","0.064872","192.168.5.101","192.168.5.93","TLSv1.2","111","Application Data"
"30","0.064873","192.168.5.101","192.168.5.93","TCP","111","[TCP Retransmission] 62762  >  3389 [PSH, ACK] Seq=87 Ack=1 Win=8210 Len=57"
"31","0.064955","192.168.5.93","192.168.5.101","TCP","66","3389  >  62762 [ACK] Seq=1 Ack=144 Win=63528 Len=0 SLE=87 SRE=144"
"32","0.065091","192.168.5.93","192.168.5.101","TCP","66","[TCP Dup ACK 31#1] 3389  >  62762 [ACK] Seq=1 Ack=144 Win=63528 Len=0 SLE=87 SRE=144"
"33","0.073122","192.168.5.65","192.168.5.68","S7COMM-PLUS","123"," > 33491 Ver:[V3] [Notification] ObjId=DynObjX7.64.2 Ctick=53 NSeq=1107764 ChngCnt=1"
"34","0.073123","192.168.5.65","192.168.5.68","TCP","123","[TCP Retransmission] 102  >  33491 [PSH, ACK] Seq=1 Ack=1 Win=8192 Len=69"
"35","0.073434","192.168.5.68","192.168.5.65","TCP","60","33491  >  102 [ACK] Seq=1 Ack=70 Win=2920 Len=0"
"36","0.073435","192.168.5.68","192.168.5.65","TCP","60","[TCP Dup ACK 35#1] 33491  >  102 [ACK] Seq=1 Ack=70 Win=2920 Len=0"
"37","0.078758","192.168.5.101","192.168.5.93","UDP","60","51844  >  3389 Len=10"
"38","0.078759","192.168.5.101","192.168.5.93","UDP","60","51844  >  3389 Len=10"
"39","0.081218","192.168.5.68","192.168.5.65","S7COMM-PLUS","159","â†\22033491 Ver:[V3] Seq=55737 [Req SetVariable] ObjId=DynObjX7.64.2"
"40","0.081218","192.168.5.68","192.168.5.65","TCP","159","[TCP Retransmission] 33491  >  102 [PSH, ACK] Seq=1 Ack=70 Win=2920 Len=105"
"41","0.092817","192.168.5.62","192.168.5.63","S7COMM","93","ROSCTR:[Job     ] Function:[Write Var]"
"42","0.092825","192.168.5.62","192.168.5.63","TCP","93","[TCP Retransmission] 59284  >  102 [PSH, ACK] Seq=32 Ack=52 Win=8192 Len=39"
"43","0.096880","192.168.5.101","192.168.5.93","TLSv1.2","97","Application Data"
"44","0.096881","192.168.5.101","192.168.5.93","TCP","97","[TCP Retransmission] 62762  >  3389 [PSH, ACK] Seq=144 Ack=1 Win=8210 Len=43"
"45","0.096931","192.168.5.93","192.168.5.101","TCP","66","3389  >  62762 [ACK] Seq=1 Ack=187 Win=63485 Len=0 SLE=144 SRE=187"
"46","0.097056","192.168.5.93","192.168.5.101","TCP","66","[TCP Dup ACK 45#1] 3389  >  62762 [ACK] Seq=1 Ack=187 Win=63485 Len=0 SLE=144 SRE=187"
"47","0.099611","192.168.5.63","192.168.5.62","S7COMM","76","ROSCTR:[Ack_Data] Function:[Write Var]"
"48","0.099611","192.168.5.63","192.168.5.62","TCP","76","[TCP Retransmission] 102  >  59284 [PSH, ACK] Seq=52 Ack=71 Win=8192 Len=22"
"49","0.108852","192.168.5.64","192.168.5.93","TCP","60","102  >  4611 [ACK] Seq=340 Ack=15 Win=8192 Len=0"
"50","0.108853","192.168.5.64","192.168.5.93","TCP","60","[TCP Dup ACK 49#1] 102  >  4611 [ACK] Seq=340 Ack=15 Win=8192 Len=0"
"51","0.112754","192.168.5.101","192.168.5.93","TLSv1.2","97","Application Data"
"52","0.112763","192.168.5.101","192.168.5.93","TCP","97","[TCP Retransmission] 62762  >  3389 [PSH, ACK] Seq=187 Ack=1 Win=8210 Len=43"
"53","0.112834","192.168.5.93","192.168.5.101","TCP","66","3389  >  62762 [ACK] Seq=1 Ack=230 Win=63442 Len=0 SLE=187 SRE=230"
"54","0.112943","192.168.5.93","192.168.5.101","TCP","66","[TCP Dup ACK 53#1] 3389  >  62762 [ACK] Seq=1 Ack=230 Win=63442 Len=0 SLE=187 SRE=230"
"55","0.128965","192.168.5.101","192.168.5.93","TLSv1.2","97","Application Data"
"56","0.128966","192.168.5.101","192.168.5.93","TCP","97","[TCP Retransmission] 62762  >  3389 [PSH, ACK] Seq=230 Ack=1 Win=8210 Len=43"
"57","0.129038","192.168.5.93","192.168.5.101","TCP","66","3389  >  62762 [ACK] Seq=1 Ack=273 Win=63399 Len=0 SLE=230 SRE=273"
"58","0.129194","192.168.5.93","192.168.5.101","TCP","66","[TCP Dup ACK 57#1] 3389  >  62762 [ACK] Seq=1 Ack=273 Win=63399 Len=0 SLE=230 SRE=273"
"59","0.152889","192.168.5.101","192.168.5.93","TLSv1.2","97","Application Data"
"60","0.152890","192.168.5.101","192.168.5.93","TCP","97","[TCP Retransmission] 62762  >  3389 [PSH, ACK] Seq=273 Ack=1 Win=8210 Len=43"
"61","0.152970","192.168.5.93","192.168.5.101","TCP","66","3389  >  62762 [ACK] Seq=1 Ack=316 Win=63356 Len=0 SLE=273 SRE=316"
"62","0.153516","192.168.5.93","192.168.5.101","TCP","66","[TCP Dup ACK 61#1] 3389  >  62762 [ACK] Seq=1 Ack=316 Win=63356 Len=0 SLE=273 SRE=316"
"63","0.177005","192.168.5.101","192.168.5.93","TLSv1.2","97","Application Data"
"64","0.177006","192.168.5.101","192.168.5.93","TCP","97","[TCP Retransmission] 62762  >  3389 [PSH, ACK] Seq=316 Ack=1 Win=8210 Len=43"
"65","0.177096","192.168.5.93","192.168.5.101","TCP","66","3389  >  62762 [ACK] Seq=1 Ack=359 Win=63313 Len=0 SLE=316 SRE=359"
"66","0.177256","192.168.5.93","192.168.5.101","TCP","66","[TCP Dup ACK 65#1] 3389  >  62762 [ACK] Seq=1 Ack=359 Win=63313 Len=0 SLE=316 SRE=359"
"67","0.184103","192.168.5.65","192.168.5.68","TCP","60","102  >  33491 [ACK] Seq=70 Ack=106 Win=8192 Len=0"
"68","0.184104","192.168.5.65","192.168.5.68","TCP","60","[TCP Dup ACK 67#1] 102  >  33491 [ACK] Seq=70 Ack=106 Win=8192 Len=0"
"69","0.192107","192.168.5.62","192.168.5.63","S7COMM","93","ROSCTR:[Job     ] Function:[Write Var]"
"70","0.192108","192.168.5.62","192.168.5.63","TCP","93","[TCP Retransmission] 59284  >  102 [PSH, ACK] Seq=71 Ack=74 Win=8192 Len=39"
"71","0.200722","192.168.5.63","192.168.5.62","S7COMM","76","ROSCTR:[Ack_Data] Function:[Write Var]"
"72","0.200723","192.168.5.63","192.168.5.62","TCP","76","[TCP Retransmission] 102  >  59284 [PSH, ACK] Seq=74 Ack=110 Win=8192 Len=22"
"73","0.221483","192.168.5.93","192.168.5.101","TLSv1.2","105","Application Data"
"74","0.221586","192.168.5.93","192.168.5.101","UDP","375","3389  >  51844 Len=333"
"75","0.221799","192.168.5.93","192.168.5.101","TCP","105","[TCP Retransmission] 3389  >  62762 [PSH, ACK] Seq=1 Ack=359 Win=63313 Len=51"
"76","0.221800","192.168.5.93","192.168.5.101","UDP","375","3389  >  51844 Len=333"
"77","0.244145","192.168.5.62","192.168.5.63","S7COMM","85","ROSCTR:[Job     ] Function:[Read Var]"
"78","0.244146","192.168.5.62","192.168.5.63","TCP","85","[TCP Retransmission] 59284  >  102 [PSH, ACK] Seq=110 Ack=96 Win=8192 Len=31"
"79","0.251671","192.168.5.63","192.168.5.62","S7COMM","83","ROSCTR:[Ack_Data] Function:[Read Var]"
"80","0.251672","192.168.5.63","192.168.5.62","TCP","83","[TCP Retransmission] 102  >  59284 [PSH, ACK] Seq=96 Ack=141 Win=8192 Len=29"
"81","0.257724","192.168.5.64","192.168.5.68","S7COMM-PLUS","123"," > 43515 Ver:[V3] [Notification] ObjId=DynObjX7.64.119 Ctick=189 NSeq=406460 ChngCnt=1"
"82","0.257730","192.168.5.101","192.168.5.93","TLSv1.2","97","Application Data"
"83","0.257734","192.168.5.101","192.168.5.93","TCP","97","[TCP Retransmission] 62762  >  3389 [PSH, ACK] Seq=359 Ack=52 Win=8209 Len=43"
"84","0.257744","192.168.5.64","192.168.5.68","TCP","123","[TCP Retransmission] 102  >  43515 [PSH, ACK] Seq=1 Ack=1 Win=8192 Len=69"
"85","0.257751","192.168.5.68","192.168.5.64","TCP","60","43515  >  102 [ACK] Seq=1 Ack=70 Win=2920 Len=0"
"86","0.257752","192.168.5.68","192.168.5.64","TCP","60","[TCP Dup ACK 85#1] 43515  >  102 [ACK] Seq=1 Ack=70 Win=2920 Len=0"
"87","0.257860","192.168.5.93","192.168.5.101","TCP","66","3389  >  62762 [ACK] Seq=52 Ack=402 Win=63270 Len=0 SLE=359 SRE=402"
"88","0.258426","192.168.5.93","192.168.5.101","TCP","66","[TCP Dup ACK 87#1] 3389  >  62762 [ACK] Seq=52 Ack=402 Win=63270 Len=0 SLE=359 SRE=402"
"89","0.264943","192.168.5.101","192.168.5.93","TLSv1.2","97","Application Data"
"90","0.264944","192.168.5.101","192.168.5.93","TCP","97","[TCP Retransmission] 62762  >  3389 [PSH, ACK] Seq=402 Ack=52 Win=8209 Len=43"
"91","0.264944","192.168.5.68","192.168.5.64","S7COMM-PLUS","159","â†\22043515 Ver:[V3] Seq=55712 [Req SetVariable] ObjId=DynObjX7.64.119"
"92","0.264944","192.168.5.68","192.168.5.64","TCP","159","[TCP Retransmission] 43515  >  102 [PSH, ACK] Seq=1 Ack=70 Win=2920 Len=105"
"93","0.265024","192.168.5.93","192.168.5.101","TCP","66","3389  >  62762 [ACK] Seq=52 Ack=445 Win=63227 Len=0 SLE=402 SRE=445"
"94","0.265163","192.168.5.93","192.168.5.101","TCP","66","[TCP Dup ACK 93#1] 3389  >  62762 [ACK] Seq=52 Ack=445 Win=63227 Len=0 SLE=402 SRE=445"
"95","0.281543","192.168.5.101","192.168.5.93","TLSv1.2","104","Application Data"
"96","0.281544","192.168.5.101","192.168.5.93","TCP","104","[TCP Retransmission] 62762  >  3389 [PSH, ACK] Seq=445 Ack=52 Win=8209 Len=50"
"97","0.281797","192.168.5.93","192.168.5.101","TCP","66","3389  >  62762 [ACK] Seq=52 Ack=495 Win=63177 Len=0 SLE=445 SRE=495"
"98","0.282354","192.168.5.93","192.168.5.101","TCP","66","[TCP Dup ACK 97#1] 3389  >  62762 [ACK] Seq=52 Ack=495 Win=63177 Len=0 SLE=445 SRE=495"
"99","0.282778","192.168.5.63","192.168.5.64","TCP","60","102  >  49155 [ACK] Seq=1 Ack=1 Win=8192 Len=0"
"100","0.282779","192.168.5.63","192.168.5.64","TCP","60","[TCP Dup ACK 99#1] 102  >  49155 [ACK] Seq=1 Ack=1 Win=8192 Len=0"
"101","0.284688","192.168.5.64","192.168.5.63","TCP","60","[TCP ACKed unseen segment] 49155  >  102 [ACK] Seq=1 Ack=2 Win=8192 Len=0"
"102","0.284689","192.168.5.64","192.168.5.63","TCP","60","[TCP Dup ACK 101#1] [TCP ACKed unseen segment] 49155  >  102 [ACK] Seq=1 Ack=2 Win=8192 Len=0"
"103","0.289009","192.168.5.101","192.168.5.93","TLSv1.2","97","Application Data"
"104","0.289010","192.168.5.101","192.168.5.93","TCP","97","[TCP Retransmission] 62762  >  3389 [PSH, ACK] Seq=495 Ack=52 Win=8209 Len=43"
"105","0.289086","192.168.5.93","192.168.5.101","TCP","66","3389  >  62762 [ACK] Seq=52 Ack=538 Win=63134 Len=0 SLE=495 SRE=538"
"106","0.289233","192.168.5.93","192.168.5.101","TCP","66","[TCP Dup ACK 105#1] 3389  >  62762 [ACK] Seq=52 Ack=538 Win=63134 Len=0 SLE=495 SRE=538"
"107","0.293136","192.168.5.62","192.168.5.63","S7COMM","93","ROSCTR:[Job     ] Function:[Write Var]"
"108","0.293136","192.168.5.62","192.168.5.63","TCP","93","[TCP Retransmission] 59284  >  102 [PSH, ACK] Seq=141 Ack=125 Win=8192 Len=39"
"109","0.302745","192.168.5.63","192.168.5.62","S7COMM","76","ROSCTR:[Ack_Data] Function:[Write Var]"
"110","0.302746","192.168.5.63","192.168.5.62","TCP","76","[TCP Retransmission] 102  >  59284 [PSH, ACK] Seq=125 Ack=180 Win=8192 Len=22"
"111","0.309668","192.168.5.64","192.168.5.68","TCP","60","102  >  43515 [ACK] Seq=70 Ack=106 Win=8192 Len=0"
"112","0.309686","192.168.5.64","192.168.5.68","TCP","60","[TCP Dup ACK 111#1] 102  >  43515 [ACK] Seq=70 Ack=106 Win=8192 Len=0"
"113","0.312917","192.168.5.101","192.168.5.93","TLSv1.2","111","Application Data"
"114","0.312917","192.168.5.101","192.168.5.93","TCP","111","[TCP Retransmission] 62762  >  3389 [PSH, ACK] Seq=538 Ack=52 Win=8209 Len=57"
"115","0.312971","192.168.5.93","192.168.5.101","TCP","66","3389  >  62762 [ACK] Seq=52 Ack=595 Win=63077 Len=0 SLE=538 SRE=595"
"116","0.313101","192.168.5.93","192.168.5.101","TCP","66","[TCP Dup ACK 115#1] 3389  >  62762 [ACK] Seq=52 Ack=595 Win=63077 Len=0 SLE=538 SRE=595"
"117","0.320922","192.168.5.101","192.168.5.93","TLSv1.2","97","Application Data"
"118","0.320923","192.168.5.101","192.168.5.93","TCP","97","[TCP Retransmission] 62762  >  3389 [PSH, ACK] Seq=595 Ack=52 Win=8209 Len=43"
"119","0.320971","192.168.5.93","192.168.5.101","TCP","66","3389  >  62762 [ACK] Seq=52 Ack=638 Win=63034 Len=0 SLE=595 SRE=638"
"120","0.321244","192.168.5.93","192.168.5.101","TCP","66","[TCP Dup ACK 119#1] 3389  >  62762 [ACK] Seq=52 Ack=638 Win=63034 Len=0 SLE=595 SRE=638"
"121","0.337912","192.168.5.93","192.168.5.64","S7COMM-PLUS","156","â†\2204611 Ver:[V3] Seq=4083 [Req SetVariable] ObjId=DynObjX7.64.505"
"122","0.338280","192.168.5.93","192.168.5.64","TCP","156","[TCP Retransmission] 4611  >  102 [PSH, ACK] Seq=15 Ack=340 Win=63494 Len=102"
"123","0.344959","192.168.5.101","192.168.5.93","TLSv1.2","111","Application Data"
"124","0.344960","192.168.5.101","192.168.5.93","TCP","111","[TCP Retransmission] 62762  >  3389 [PSH, ACK] Seq=638 Ack=52 Win=8209 Len=57"
"125","0.345028","192.168.5.93","192.168.5.101","TCP","66","3389  >  62762 [ACK] Seq=52 Ack=695 Win=62977 Len=0 SLE=638 SRE=695"
"126","0.345310","192.168.5.93","192.168.5.101","TCP","66","[TCP Dup ACK 125#1] 3389  >  62762 [ACK] Seq=52 Ack=695 Win=62977 Len=0 SLE=638 SRE=695"
"127","0.353460","Netgear_11:52:b3","All-RBridges","Slow Protocols","60","Subtype = 136"
"128","0.353871","Netgear_11:52:b3","All-RBridges","Slow Protocols","60","Subtype = 136"
"129","0.353970","Netgear_11:52:b3","All-RBridges","Slow Protocols","60","Subtype = 136"
"130","0.354264","Netgear_11:52:b3","All-RBridges","Slow Protocols","60","Subtype = 136"
"131","0.354548","Netgear_11:52:b3","All-RBridges","Slow Protocols","60","Subtype = 136"
"132","0.354799","Netgear_11:52:b3","All-RBridges","Slow Protocols","60","Subtype = 136"
"133","0.354916","Netgear_11:52:b3","All-RBridges","Slow Protocols","60","Subtype = 136"
"134","0.354990","Netgear_11:52:b3","All-RBridges","Slow Protocols","60","Subtype = 136"
"135","0.355158","Netgear_11:52:b3","All-RBridges","Slow Protocols","60","Subtype = 136"
"136","0.355287","Netgear_11:52:b3","All-RBridges","Slow Protocols","60","Subtype = 136"
"137","0.355597","Netgear_11:52:b3","All-RBridges","Slow Protocols","60","Subtype = 136"
"138","0.355741","Netgear_11:52:b3","All-RBridges","Slow Protocols","60","Subtype = 136"
"139","0.355870","Netgear_11:52:b3","All-RBridges","Slow Protocols","60","Subtype = 136"
"140","0.356030","Netgear_11:52:b3","All-RBridges","Slow Protocols","60","Subtype = 136"
"141","0.356185","Netgear_11:52:b3","All-RBridges","Slow Protocols","60","Subtype = 136"
"142","0.356477","Netgear_11:52:b3","All-RBridges","Slow Protocols","60","Subtype = 136"
"143","0.358058","192.168.5.64","192.168.5.93","S7COMM-PLUS","119"," > 4611 Ver:[V3] Seq=4083 [Res SetVariable] Retval=OK"
"144","0.358071","192.168.5.64","192.168.5.93","TCP","119","[TCP Retransmission] 102  >  4611 [PSH, ACK] Seq=340 Ack=117 Win=8192 Len=65"
"145","0.358603","192.168.5.93","192.168.5.64","TCP","54","4611  >  102 [ACK] Seq=117 Ack=405 Win=63429 Len=0"
"146","0.359104","192.168.5.93","192.168.5.64","TCP","60","[TCP Dup ACK 145#1] 4611  >  102 [ACK] Seq=117 Ack=405 Win=63429 Len=0"
"147","0.360577","192.168.5.93","192.168.5.64","COTP","61","DT TPDU (0) [COTP fragment, 0 bytes]"
"148","0.361408","192.168.5.101","192.168.5.93","TLSv1.2","104","Application Data"
"149","0.361411","192.168.5.101","192.168.5.93","TCP","104","[TCP Retransmission] 62762  >  3389 [PSH, ACK] Seq=695 Ack=52 Win=8209 Len=50"
"150","0.361529","192.168.5.93","192.168.5.101","TCP","66","3389  >  62762 [ACK] Seq=52 Ack=745 Win=62927 Len=0 SLE=695 SRE=745"
"151","0.361840","192.168.5.93","192.168.5.64","TCP","61","[TCP Retransmission] 4611  >  102 [PSH, ACK] Seq=117 Ack=405 Win=63429 Len=7"
"152","0.362041","192.168.5.93","192.168.5.101","TCP","66","[TCP Dup ACK 150#1] 3389  >  62762 [ACK] Seq=52 Ack=745 Win=62927 Len=0 SLE=695 SRE=745"
"153","0.369035","192.168.5.101","192.168.5.93","TLSv1.2","97","Application Data"
"154","0.369036","192.168.5.101","192.168.5.93","TCP","97","[TCP Retransmission] 62762  >  3389 [PSH, ACK] Seq=745 Ack=52 Win=8209 Len=43"
"155","0.369074","192.168.5.93","192.168.5.101","TCP","66","3389  >  62762 [ACK] Seq=52 Ack=788 Win=62884 Len=0 SLE=745 SRE=788"
"156","0.369245","192.168.5.93","192.168.5.101","TCP","66","[TCP Dup ACK 155#1] 3389  >  62762 [ACK] Seq=52 Ack=788 Win=62884 Len=0 SLE=745 SRE=788"
"157","0.378739","192.168.5.101","192.168.5.93","UDP","60","51844  >  3389 Len=13"
"158","0.378740","192.168.5.101","192.168.5.93","UDP","60","51844  >  3389 Len=13"
"159","0.378853","192.168.5.64","192.168.5.93","S7COMM-PLUS","328"," > 4611 Ver:[V3] [Notification] ObjId=DynObjX7.64.504 Ctick=0 NSeq=5512 ChngCnt=1 <Contains values>"
"160","0.378856","192.168.5.64","192.168.5.93","TCP","328","[TCP Retransmission] 102  >  4611 [PSH, ACK] Seq=405 Ack=124 Win=8192 Len=274"
"161","0.378892","192.168.5.93","192.168.5.64","TCP","54","4611  >  102 [ACK] Seq=124 Ack=679 Win=63155 Len=0"
"162","0.379122","192.168.5.93","192.168.5.64","COTP","61","DT TPDU (0) [COTP fragment, 0 bytes]"
"163","0.379274","192.168.5.93","192.168.5.64","TCP","60","4611  >  102 [ACK] Seq=124 Ack=679 Win=63155 Len=0"
"164","0.379275","192.168.5.93","192.168.5.64","TCP","61","[TCP Retransmission] 4611  >  102 [PSH, ACK] Seq=124 Ack=679 Win=63155 Len=7"
"165","0.385578","192.168.5.67","192.168.5.68","S7COMM-PLUS","81"," > 59899 Ver:[Ext. Keep Alive] ConfirmedBytes=38934607"
"166","0.385578","192.168.5.67","192.168.5.68","TCP","81","[TCP Retransmission] 102  >  59899 [PSH, ACK] Seq=1 Ack=1 Win=8192 Len=27"
"167","0.385582","192.168.5.68","192.168.5.67","TCP","60","59899  >  102 [ACK] Seq=1 Ack=28 Win=2920 Len=0"
"168","0.385595","192.168.5.68","192.168.5.67","TCP","60","[TCP Dup ACK 167#1] 59899  >  102 [ACK] Seq=1 Ack=28 Win=2920 Len=0"
"169","0.392105","192.168.5.62","192.168.5.63","S7COMM","93","ROSCTR:[Job     ] Function:[Write Var]"
"170","0.392106","192.168.5.62","192.168.5.63","TCP","93","[TCP Retransmission] 59284  >  102 [PSH, ACK] Seq=180 Ack=147 Win=8192 Len=39"
"171","0.392921","192.168.5.101","192.168.5.93","TLSv1.2","111","Application Data"
"172","0.392921","192.168.5.101","192.168.5.93","TCP","111","[TCP Retransmission] 62762  >  3389 [PSH, ACK] Seq=788 Ack=52 Win=8209 Len=57"
"173","0.392974","192.168.5.93","192.168.5.101","TCP","66","3389  >  62762 [ACK] Seq=52 Ack=845 Win=62827 Len=0 SLE=788 SRE=845"
"174","0.393134","192.168.5.93","192.168.5.101","TCP","66","[TCP Dup ACK 173#1] 3389  >  62762 [ACK] Seq=52 Ack=845 Win=62827 Len=0 SLE=788 SRE=845"
"175","0.400754","192.168.5.63","192.168.5.62","S7COMM","76","ROSCTR:[Ack_Data] Function:[Write Var]"
"176","0.400755","192.168.5.63","192.168.5.62","TCP","76","[TCP Retransmission] 102  >  59284 [PSH, ACK] Seq=147 Ack=219 Win=8192 Len=22"
"177","0.400881","192.168.5.101","192.168.5.93","TLSv1.2","97","Application Data"
"178","0.400882","192.168.5.101","192.168.5.93","TCP","97","[TCP Retransmission] 62762  >  3389 [PSH, ACK] Seq=845 Ack=52 Win=8209 Len=43"
"179","0.400952","192.168.5.93","192.168.5.101","TCP","66","3389  >  62762 [ACK] Seq=52 Ack=888 Win=62784 Len=0 SLE=845 SRE=888"
"180","0.401126","192.168.5.93","192.168.5.101","TCP","66","[TCP Dup ACK 179#1] 3389  >  62762 [ACK] Seq=52 Ack=888 Win=62784 Len=0 SLE=845 SRE=888"
"181","0.409716","192.168.5.64","192.168.5.93","TCP","60","102  >  4611 [ACK] Seq=679 Ack=131 Win=8192 Len=0"
"182","0.409720","192.168.5.64","192.168.5.93","TCP","60","[TCP Dup ACK 181#1] 102  >  4611 [ACK] Seq=679 Ack=131 Win=8192 Len=0"
"183","0.442119","192.168.5.62","192.168.5.63","S7COMM","85","ROSCTR:[Job     ] Function:[Read Var]"
"184","0.442120","192.168.5.62","192.168.5.63","TCP","85","[TCP Retransmission] 59284  >  102 [PSH, ACK] Seq=219 Ack=169 Win=8192 Len=31"
"185","0.448694","192.168.5.63","192.168.5.62","S7COMM","83","ROSCTR:[Ack_Data] Function:[Read Var]"
"186","0.448695","192.168.5.63","192.168.5.62","TCP","83","[TCP Retransmission] 102  >  59284 [PSH, ACK] Seq=169 Ack=250 Win=8192 Len=29"
"187","0.492127","192.168.5.62","192.168.5.63","S7COMM","93","ROSCTR:[Job     ] Function:[Write Var]"
"188","0.492128","192.168.5.62","192.168.5.63","TCP","93","[TCP Retransmission] 59284  >  102 [PSH, ACK] Seq=250 Ack=198 Win=8192 Len=39"
"189","0.499676","192.168.5.63","192.168.5.62","S7COMM","76","ROSCTR:[Ack_Data] Function:[Write Var]"
"190","0.499677","192.168.5.63","192.168.5.62","TCP","76","[TCP Retransmission] 102  >  59284 [PSH, ACK] Seq=198 Ack=289 Win=8192 Len=22"
"191","0.584460","192.168.5.93","192.168.5.101","UDP","190","3389  >  51844 Len=148"
"192","0.586081","192.168.5.93","192.168.5.101","UDP","190","3389  >  51844 Len=148"
"193","0.594124","192.168.5.62","192.168.5.63","S7COMM","93","ROSCTR:[Job     ] Function:[Write Var]"
"194","0.594124","192.168.5.62","192.168.5.63","TCP","93","[TCP Retransmission] 59284  >  102 [PSH, ACK] Seq=289 Ack=220 Win=8192 Len=39"
"195","0.600673","192.168.5.63","192.168.5.62","S7COMM","76","ROSCTR:[Ack_Data] Function:[Write Var]"
"196","0.600674","192.168.5.63","192.168.5.62","TCP","76","[TCP Retransmission] 102  >  59284 [PSH, ACK] Seq=220 Ack=328 Win=8192 Len=22"
"197","0.643196","192.168.5.62","192.168.5.63","S7COMM","85","ROSCTR:[Job     ] Function:[Read Var]"
"198","0.643196","192.168.5.62","192.168.5.63","TCP","85","[TCP Retransmission] 59284  >  102 [PSH, ACK] Seq=328 Ack=242 Win=8192 Len=31"
"199","0.649879","192.168.5.64","192.168.5.93","S7COMM-PLUS","122"," > 4611 Ver:[V3] [Notification] ObjId=DynObjX7.64.487 Ctick=0 NSeq=5513 ChngCnt=2"
"200","0.649880","192.168.5.64","192.168.5.93","TCP","122","[TCP Retransmission] 102  >  4611 [PSH, ACK] Seq=679 Ack=131 Win=8192 Len=68"
"201","0.649939","192.168.5.93","192.168.5.64","TCP","54","4611  >  102 [ACK] Seq=131 Ack=747 Win=63087 Len=0"
"202","0.650118","192.168.5.93","192.168.5.64","TCP","60","[TCP Dup ACK 201#1] 4611  >  102 [ACK] Seq=131 Ack=747 Win=63087 Len=0"
"203","0.650126","192.168.5.93","192.168.5.64","COTP","61","DT TPDU (0) [COTP fragment, 0 bytes]"
"204","0.650211","192.168.5.93","192.168.5.64","TCP","61","[TCP Retransmission] 4611  >  102 [PSH, ACK] Seq=131 Ack=747 Win=63087 Len=7"
"205","0.650621","192.168.5.63","192.168.5.62","S7COMM","83","ROSCTR:[Ack_Data] Function:[Read Var]"
"206","0.650622","192.168.5.63","192.168.5.62","TCP","83","[TCP Retransmission] 102  >  59284 [PSH, ACK] Seq=242 Ack=359 Win=8192 Len=29"
"207","0.664691","192.168.5.66","192.168.5.68","S7COMM-PLUS","123"," > 54765 Ver:[V3] [Notification] ObjId=DynObjX7.64.2 Ctick=51 NSeq=1107762 ChngCnt=1"
"208","0.664699","192.168.5.66","192.168.5.68","TCP","123","[TCP Retransmission] 102  >  54765 [PSH, ACK] Seq=1 Ack=1 Win=8192 Len=69"
"209","0.693283","192.168.5.62","192.168.5.63","S7COMM","93","ROSCTR:[Job     ] Function:[Write Var]"
"210","0.693284","192.168.5.62","192.168.5.63","TCP","93","[TCP Retransmission] 59284  >  102 [PSH, ACK] Seq=359 Ack=271 Win=8192 Len=39"
"211","0.695612","192.168.5.93","192.168.5.64","S7COMM-PLUS","156","â†\2204611 Ver:[V3] Seq=4084 [Req SetVariable] ObjId=DynObjX7.64.505"
"212","0.695860","192.168.5.93","192.168.5.64","TCP","156","[TCP Retransmission] 4611  >  102 [PSH, ACK] Seq=138 Ack=747 Win=63087 Len=102"
"213","0.701291","192.168.5.93","192.168.5.101","UDP","99","3389  >  51844 Len=57"
"214","0.701582","192.168.5.93","192.168.5.101","UDP","99","3389  >  51844 Len=57"
"215","0.701645","192.168.5.63","192.168.5.62","S7COMM","76","ROSCTR:[Ack_Data] Function:[Write Var]"
"216","0.701645","192.168.5.63","192.168.5.62","TCP","76","[TCP Retransmission] 102  >  59284 [PSH, ACK] Seq=271 Ack=398 Win=8192 Len=22"
"217","0.703330","192.168.5.68","192.168.5.66","TCP","60","54765  >  102 [ACK] Seq=1 Ack=70 Win=2920 Len=0"
"218","0.703330","192.168.5.68","192.168.5.66","TCP","60","[TCP Dup ACK 217#1] 54765  >  102 [ACK] Seq=1 Ack=70 Win=2920 Len=0"
"219","0.711831","192.168.5.64","192.168.5.93","TCP","60","102  >  4611 [ACK] Seq=747 Ack=240 Win=8192 Len=0"
"220","0.711831","192.168.5.64","192.168.5.93","TCP","60","[TCP Dup ACK 219#1] 102  >  4611 [ACK] Seq=747 Ack=240 Win=8192 Len=0"
"221","0.715165","192.168.5.64","192.168.5.93","S7COMM-PLUS","119"," > 4611 Ver:[V3] Seq=4084 [Res SetVariable] Retval=OK"
"222","0.715166","192.168.5.64","192.168.5.93","TCP","119","[TCP Retransmission] 102  >  4611 [PSH, ACK] Seq=747 Ack=240 Win=8192 Len=65"
"223","0.715262","192.168.5.93","192.168.5.64","TCP","54","4611  >  102 [ACK] Seq=240 Ack=812 Win=63022 Len=0"
"224","0.718256","192.168.5.93","192.168.5.64","TCP","60","[TCP Dup ACK 223#1] 4611  >  102 [ACK] Seq=240 Ack=812 Win=63022 Len=0"
"225","0.718938","192.168.5.93","192.168.5.64","COTP","61","DT TPDU (0) [COTP fragment, 0 bytes]"
"226","0.719169","192.168.5.93","192.168.5.64","TCP","61","[TCP Retransmission] 4611  >  102 [PSH, ACK] Seq=240 Ack=812 Win=63022 Len=7"
"227","0.722972","192.168.5.64","192.168.5.93","S7COMM-PLUS","81"," > 4611 Ver:[Ext. Keep Alive] ConfirmedBytes=362739"
"228","0.722973","192.168.5.64","192.168.5.93","TCP","81","[TCP Retransmission] 102  >  4611 [PSH, ACK] Seq=812 Ack=240 Win=8192 Len=27"
"229","0.723027","192.168.5.93","192.168.5.64","TCP","54","4611  >  102 [ACK] Seq=247 Ack=839 Win=62995 Len=0"
"230","0.723186","192.168.5.93","192.168.5.64","TCP","60","[TCP Dup ACK 229#1] 4611  >  102 [ACK] Seq=247 Ack=839 Win=62995 Len=0"
"231","0.723321","192.168.5.93","192.168.5.64","COTP","61","DT TPDU (0) [COTP fragment, 0 bytes]"
"232","0.723442","192.168.5.93","192.168.5.64","TCP","61","[TCP Retransmission] 4611  >  102 [PSH, ACK] Seq=247 Ack=839 Win=62995 Len=7"
"233","0.734092","192.168.5.64","192.168.5.68","S7COMM-PLUS","81"," > 43515 Ver:[Ext. Keep Alive] ConfirmedBytes=14295859"
"234","0.734092","192.168.5.64","192.168.5.68","TCP","81","[TCP Retransmission] 102  >  43515 [PSH, ACK] Seq=70 Ack=106 Win=8192 Len=27"
"235","0.739861","192.168.5.101","192.168.5.93","UDP","60","51844  >  3389 Len=11"
"236","0.739865","192.168.5.101","192.168.5.93","UDP","60","51844  >  3389 Len=11"
"237","0.745936","192.168.5.64","192.168.5.93","S7COMM-PLUS","328"," > 4611 Ver:[V3] [Notification] ObjId=DynObjX7.64.504 Ctick=0 NSeq=5514 ChngCnt=1 <Contains values>"
"238","0.745937","192.168.5.64","192.168.5.93","TCP","328","[TCP Retransmission] 102  >  4611 [PSH, ACK] Seq=839 Ack=254 Win=8192 Len=274"
"239","0.745981","192.168.5.93","192.168.5.64","TCP","54","4611  >  102 [ACK] Seq=254 Ack=1113 Win=64240 Len=0"
"240","0.746231","192.168.5.93","192.168.5.64","TCP","60","[TCP Dup ACK 239#1] 4611  >  102 [ACK] Seq=254 Ack=1113 Win=64240 Len=0"
"241","0.746288","192.168.5.93","192.168.5.64","COTP","61","DT TPDU (0) [COTP fragment, 0 bytes]"
"242","0.746430","192.168.5.93","192.168.5.64","TCP","61","[TCP Retransmission] 4611  >  102 [PSH, ACK] Seq=254 Ack=1113 Win=64240 Len=7"
"243","0.768162","192.168.5.68","192.168.5.64","TCP","60","43515  >  102 [ACK] Seq=106 Ack=97 Win=2920 Len=0"
"244","0.768175","192.168.5.68","192.168.5.64","TCP","60","[TCP Dup ACK 243#1] 43515  >  102 [ACK] Seq=106 Ack=97 Win=2920 Len=0"
"245","0.793238","192.168.5.62","192.168.5.63","S7COMM","93","ROSCTR:[Job     ] Function:[Write Var]"
"246","0.793244","192.168.5.62","192.168.5.63","TCP","93","[TCP Retransmission] 59284  >  102 [PSH, ACK] Seq=398 Ack=293 Win=8192 Len=39"
"247","0.799826","192.168.5.63","192.168.5.62","S7COMM","76","ROSCTR:[Ack_Data] Function:[Write Var]"
"248","0.799827","192.168.5.63","192.168.5.62","TCP","76","[TCP Retransmission] 102  >  59284 [PSH, ACK] Seq=293 Ack=437 Win=8192 Len=22"
"249","0.807756","192.168.5.93","192.168.5.101","UDP","404","3389  >  51844 Len=362"
"250","0.808531","192.168.5.93","192.168.5.101","UDP","404","3389  >  51844 Len=362"
"251","0.809843","192.168.5.64","192.168.5.93","TCP","60","102  >  4611 [ACK] Seq=1113 Ack=261 Win=8192 Len=0"
"252","0.809844","192.168.5.64","192.168.5.93","TCP","60","[TCP Dup ACK 251#1] 102  >  4611 [ACK] Seq=1113 Ack=261 Win=8192 Len=0"
"253","0.817584","192.168.5.101","192.168.5.93","TLSv1.2","104","Application Data"
"254","0.817590","192.168.5.101","192.168.5.93","TCP","104","[TCP Retransmission] 62762  >  3389 [PSH, ACK] Seq=888 Ack=52 Win=8209 Len=50"
"255","0.818224","192.168.5.93","192.168.5.101","TCP","66","3389  >  62762 [ACK] Seq=52 Ack=938 Win=62734 Len=0 SLE=888 SRE=938"
"256","0.819610","192.168.5.93","192.168.5.101","TCP","66","[TCP Dup ACK 255#1] 3389  >  62762 [ACK] Seq=52 Ack=938 Win=62734 Len=0 SLE=888 SRE=938"
"257","0.828484","192.168.5.67","192.168.5.68","S7COMM-PLUS","123"," > 59899 Ver:[V3] [Notification] ObjId=DynObjX7.64.121 Ctick=50 NSeq=1107761 ChngCnt=1"
"258","0.828485","192.168.5.67","192.168.5.68","TCP","123","[TCP Retransmission] 102  >  59899 [PSH, ACK] Seq=28 Ack=1 Win=8192 Len=69"
"259","0.828632","192.168.5.68","192.168.5.67","TCP","60","59899  >  102 [ACK] Seq=1 Ack=97 Win=2920 Len=0"
"260","0.828633","192.168.5.68","192.168.5.67","TCP","60","[TCP Dup ACK 259#1] 59899  >  102 [ACK] Seq=1 Ack=97 Win=2920 Len=0"
"261","0.838498","192.168.5.68","192.168.5.67","S7COMM-PLUS","159","â†\22059899 Ver:[V3] Seq=55717 [Req SetVariable] ObjId=DynObjX7.64.121"
"262","0.838504","192.168.5.68","192.168.5.67","TCP","159","[TCP Retransmission] 59899  >  102 [PSH, ACK] Seq=1 Ack=97 Win=2920 Len=105"
"263","0.842952","192.168.5.62","192.168.5.63","S7COMM","85","ROSCTR:[Job     ] Function:[Read Var]"
"264","0.842953","192.168.5.62","192.168.5.63","TCP","85","[TCP Retransmission] 59284  >  102 [PSH, ACK] Seq=437 Ack=315 Win=8192 Len=31"
"265","0.843351","192.168.5.67","192.168.5.68","TCP","60","102  >  59899 [ACK] Seq=97 Ack=106 Win=8192 Len=0"
"266","0.843351","192.168.5.67","192.168.5.68","TCP","60","[TCP Dup ACK 265#1] 102  >  59899 [ACK] Seq=97 Ack=106 Win=8192 Len=0"
"267","0.847719","192.168.5.63","192.168.5.62","S7COMM","83","ROSCTR:[Ack_Data] Function:[Read Var]"
"268","0.847719","192.168.5.63","192.168.5.62","TCP","83","[TCP Retransmission] 102  >  59284 [PSH, ACK] Seq=315 Ack=468 Win=8192 Len=29"
"269","0.848967","192.168.5.101","192.168.5.93","TLSv1.2","97","Application Data"
"270","0.848967","192.168.5.101","192.168.5.93","TCP","97","[TCP Retransmission] 62762  >  3389 [PSH, ACK] Seq=938 Ack=52 Win=8209 Len=43"
"271","0.849018","192.168.5.93","192.168.5.101","TCP","66","3389  >  62762 [ACK] Seq=52 Ack=981 Win=62691 Len=0 SLE=938 SRE=981"
"272","0.849165","192.168.5.93","192.168.5.101","TCP","66","[TCP Dup ACK 271#1] 3389  >  62762 [ACK] Seq=52 Ack=981 Win=62691 Len=0 SLE=938 SRE=981"
"273","0.865830","192.168.5.101","192.168.5.93","TLSv1.2","104","Application Data"
"274","0.865833","192.168.5.101","192.168.5.93","TCP","104","[TCP Retransmission] 62762  >  3389 [PSH, ACK] Seq=981 Ack=52 Win=8209 Len=50"
"275","0.865911","192.168.5.93","192.168.5.101","TCP","66","3389  >  62762 [ACK] Seq=52 Ack=1031 Win=62641 Len=0 SLE=981 SRE=1031"
"276","0.866477","192.168.5.93","192.168.5.101","TCP","66","[TCP Dup ACK 275#1] 3389  >  62762 [ACK] Seq=52 Ack=1031 Win=62641 Len=0 SLE=981 SRE=1031"
"277","0.872991","192.168.5.101","192.168.5.93","TLSv1.2","97","Application Data"
"278","0.872992","192.168.5.101","192.168.5.93","TCP","97","[TCP Retransmission] 62762  >  3389 [PSH, ACK] Seq=1031 Ack=52 Win=8209 Len=43"
"279","0.873044","192.168.5.93","192.168.5.101","TCP","66","3389  >  62762 [ACK] Seq=52 Ack=1074 Win=62598 Len=0 SLE=1031 SRE=1074"
"280","0.873223","192.168.5.93","192.168.5.101","TCP","66","[TCP Dup ACK 279#1] 3389  >  62762 [ACK] Seq=52 Ack=1074 Win=62598 Len=0 SLE=1031 SRE=1074"
"281","0.875906","192.168.5.93","192.168.5.101","UDP","1279","3389  >  51844 Len=1237"
"282","0.876141","192.168.5.93","192.168.5.101","UDP","1279","3389  >  51844 Len=1237"
"283","0.876218","192.168.5.93","192.168.5.101","UDP","1279","3389  >  51844 Len=1237"
"284","0.876279","192.168.5.93","192.168.5.101","UDP","1086","3389  >  51844 Len=1044"
"285","0.876358","192.168.5.93","192.168.5.101","UDP","1279","3389  >  51844 Len=1237"
"286","0.876610","192.168.5.93","192.168.5.101","UDP","1279","3389  >  51844 Len=1237"
"287","0.876721","192.168.5.93","192.168.5.101","UDP","1086","3389  >  51844 Len=1044"
"288","0.876721","192.168.5.93","192.168.5.101","UDP","1279","3389  >  51844 Len=1237"
"289","0.876763","192.168.5.93","192.168.5.101","UDP","428","3389  >  51844 Len=386"
"290","0.877345","192.168.5.93","192.168.5.101","UDP","428","3389  >  51844 Len=386"
"291","0.890917","192.168.5.101","192.168.5.93","TLSv1.2","104","Application Data"
"292","0.890923","192.168.5.101","192.168.5.93","TCP","104","[TCP Retransmission] 62762  >  3389 [PSH, ACK] Seq=1074 Ack=52 Win=8209 Len=50"
"293","0.890923","192.168.5.101","192.168.5.93","UDP","236","51844  >  3389 Len=194"
"294","0.890926","192.168.5.101","192.168.5.93","UDP","236","51844  >  3389 Len=194"
"295","0.891515","192.168.5.93","192.168.5.101","TCP","66","3389  >  62762 [ACK] Seq=52 Ack=1124 Win=62548 Len=0 SLE=1074 SRE=1124"
"296","0.892073","192.168.5.93","192.168.5.101","TCP","66","[TCP Dup ACK 295#1] 3389  >  62762 [ACK] Seq=52 Ack=1124 Win=62548 Len=0 SLE=1074 SRE=1124"
"297","0.894127","192.168.5.62","192.168.5.63","S7COMM","93","ROSCTR:[Job     ] Function:[Write Var]"
"298","0.894128","192.168.5.62","192.168.5.63","TCP","93","[TCP Retransmission] 59284  >  102 [PSH, ACK] Seq=468 Ack=344 Win=8192 Len=39"
"299","0.898636","Siemens_71:45:3c","LLDP_Multicast","PN-PTCP","60","DelayReq         , Seq=41163, Delay=          0ns, PortMAC=d4:f5:27:71:45:3c"
"300","0.898636","Siemens_71:45:3c","LLDP_Multicast","PN-PTCP","60","DelayReq         , Seq=41163, Delay=          0ns, PortMAC=d4:f5:27:71:45:3c"
"301","0.898637","Siemens_71:45:3c","LLDP_Multicast","PN-PTCP","60","DelayReq         , Seq=41163, Delay=          0ns, PortMAC=d4:f5:27:71:45:3c"
"302","0.901711","192.168.5.63","192.168.5.62","S7COMM","76","ROSCTR:[Ack_Data] Function:[Write Var]"
"303","0.901712","192.168.5.63","192.168.5.62","TCP","76","[TCP Retransmission] 102  >  59284 [PSH, ACK] Seq=344 Ack=507 Win=8192 Len=22"
"304","0.903763","192.168.5.93","192.168.5.101","UDP","53","3389  >  51844 Len=11"
"305","0.903861","192.168.5.93","192.168.5.101","UDP","52","3389  >  51844 Len=10"
"306","0.903981","192.168.5.93","192.168.5.101","UDP","60","3389  >  51844 Len=11"
"307","0.903982","192.168.5.93","192.168.5.101","UDP","60","3389  >  51844 Len=10"
"308","0.904726","192.168.5.101","192.168.5.93","TLSv1.2","104","Application Data"
"309","0.904727","192.168.5.101","192.168.5.93","TCP","104","[TCP Retransmission] 62762  >  3389 [PSH, ACK] Seq=1124 Ack=52 Win=8209 Len=50"
"310","0.904776","192.168.5.93","192.168.5.101","TCP","66","3389  >  62762 [ACK] Seq=52 Ack=1174 Win=64000 Len=0 SLE=1124 SRE=1174"
"311","0.904930","192.168.5.93","192.168.5.101","TCP","66","[TCP Dup ACK 310#1] 3389  >  62762 [ACK] Seq=52 Ack=1174 Win=64000 Len=0 SLE=1124 SRE=1174"
"312","0.920938","192.168.5.101","192.168.5.93","TLSv1.2","104","Application Data"
"313","0.920938","192.168.5.101","192.168.5.93","TCP","104","[TCP Retransmission] 62762  >  3389 [PSH, ACK] Seq=1174 Ack=52 Win=8209 Len=50"
"314","0.920998","192.168.5.93","192.168.5.101","TCP","66","3389  >  62762 [ACK] Seq=52 Ack=1224 Win=63950 Len=0 SLE=1174 SRE=1224"
"315","0.921178","192.168.5.93","192.168.5.101","TCP","66","[TCP Dup ACK 314#1] 3389  >  62762 [ACK] Seq=52 Ack=1224 Win=63950 Len=0 SLE=1174 SRE=1224"
"316","0.929181","192.168.5.101","192.168.5.93","TLSv1.2","97","Application Data"
"317","0.929182","192.168.5.101","192.168.5.93","TCP","97","[TCP Retransmission] 62762  >  3389 [PSH, ACK] Seq=1224 Ack=52 Win=8209 Len=43"
"318","0.929236","192.168.5.93","192.168.5.101","TCP","66","3389  >  62762 [ACK] Seq=52 Ack=1267 Win=63907 Len=0 SLE=1224 SRE=1267"
"319","0.929397","192.168.5.93","192.168.5.101","TCP","66","[TCP Dup ACK 318#1] 3389  >  62762 [ACK] Seq=52 Ack=1267 Win=63907 Len=0 SLE=1224 SRE=1267"
"320","0.952800","192.168.5.101","192.168.5.93","TLSv1.2","111","Application Data"
"321","0.952801","192.168.5.101","192.168.5.93","TCP","111","[TCP Retransmission] 62762  >  3389 [PSH, ACK] Seq=1267 Ack=52 Win=8209 Len=57"
"322","0.952869","192.168.5.93","192.168.5.101","TCP","66","3389  >  62762 [ACK] Seq=52 Ack=1324 Win=63850 Len=0 SLE=1267 SRE=1324"
"323","0.953241","192.168.5.93","192.168.5.101","TCP","66","[TCP Dup ACK 322#1] 3389  >  62762 [ACK] Seq=52 Ack=1324 Win=63850 Len=0 SLE=1267 SRE=1324"
"324","0.968069","192.168.5.93","192.168.5.101","UDP","234","3389  >  51844 Len=192"
"325","0.968342","192.168.5.93","192.168.5.101","UDP","234","3389  >  51844 Len=192"
"326","0.970143","192.168.5.101","192.168.5.93","TLSv1.2","104","Application Data"
"327","0.970144","192.168.5.101","192.168.5.93","TCP","104","[TCP Retransmission] 62762  >  3389 [PSH, ACK] Seq=1324 Ack=52 Win=8209 Len=50"
"328","0.970198","192.168.5.93","192.168.5.101","TCP","66","3389  >  62762 [ACK] Seq=52 Ack=1374 Win=63800 Len=0 SLE=1324 SRE=1374"
"329","0.970323","192.168.5.93","192.168.5.101","TCP","66","[TCP Dup ACK 328#1] 3389  >  62762 [ACK] Seq=52 Ack=1374 Win=63800 Len=0 SLE=1324 SRE=1374"
"330","0.986419","192.168.5.101","192.168.5.93","TLSv1.2","104","Application Data"
"331","0.986419","192.168.5.101","192.168.5.93","TCP","104","[TCP Retransmission] 62762  >  3389 [PSH, ACK] Seq=1374 Ack=52 Win=8209 Len=50"
"332","0.987273","192.168.5.93","192.168.5.101","TCP","66","3389  >  62762 [ACK] Seq=52 Ack=1424 Win=63750 Len=0 SLE=1374 SRE=1424"
"333","0.987864","192.168.5.93","192.168.5.101","TCP","66","[TCP Dup ACK 332#1] 3389  >  62762 [ACK] Seq=52 Ack=1424 Win=63750 Len=0 SLE=1374 SRE=1424"
