"No.","Time","Source","Destination","Protocol","Length","Info"
"1","0.000000","192.168.5.62","192.168.5.63","S7COMM","93","ROSCTR:[Job     ] Function:[Write Var]"
"2","0.000002","192.168.5.62","192.168.5.63","TCP","93","[TCP Retransmission] 59284  >  102 [PSH, ACK] Seq=1 Ack=1 Win=8192 Len=39"
"3","0.007523","192.168.5.63","192.168.5.62","S7COMM","76","ROSCTR:[Ack_Data] Function:[Write Var]"
"4","0.007524","192.168.5.63","192.168.5.62","TCP","76","[TCP Retransmission] 102  >  59284 [PSH, ACK] Seq=1 Ack=40 Win=8192 Len=22"
"5","0.048995","192.168.5.62","192.168.5.63","S7COMM","85","ROSCTR:[Job     ] Function:[Read Var]"
"6","0.048996","192.168.5.62","192.168.5.63","TCP","85","[TCP Retransmission] 59284  >  102 [PSH, ACK] Seq=40 Ack=23 Win=8192 Len=31"
"7","0.055489","192.168.5.63","192.168.5.62","S7COMM","83","ROSCTR:[Ack_Data] Function:[Read Var]"
"8","0.055491","192.168.5.63","192.168.5.62","TCP","83","[TCP Retransmission] 102  >  59284 [PSH, ACK] Seq=23 Ack=71 Win=8192 Len=29"
"9","0.069072","192.168.5.66","192.168.5.68","S7COMM-PLUS","123"," > 54765 Ver:[V3] [Notification] ObjId=DynObjX7.64.2 Ctick=161 NSeq=1108896 ChngCnt=1"
"10","0.069073","192.168.5.66","192.168.5.68","TCP","123","[TCP Retransmission] 102  >  54765 [PSH, ACK] Seq=1 Ack=1 Win=8192 Len=69"
"11","0.069224","192.168.5.68","192.168.5.66","TCP","60","54765  >  102 [ACK] Seq=1 Ack=70 Win=2920 Len=0"
"12","0.069225","192.168.5.68","192.168.5.66","TCP","60","[TCP Dup ACK 11#1] 54765  >  102 [ACK] Seq=1 Ack=70 Win=2920 Len=0"
"13","0.099004","192.168.5.62","192.168.5.63","S7COMM","93","ROSCTR:[Job     ] Function:[Write Var]"
"14","0.099006","192.168.5.62","192.168.5.63","TCP","93","[TCP Retransmission] 59284  >  102 [PSH, ACK] Seq=71 Ack=52 Win=8192 Len=39"
"15","0.108574","192.168.5.63","192.168.5.62","S7COMM","76","ROSCTR:[Ack_Data] Function:[Write Var]"
"16","0.108575","192.168.5.63","192.168.5.62","TCP","76","[TCP Retransmission] 102  >  59284 [PSH, ACK] Seq=52 Ack=110 Win=8192 Len=22"
"17","0.128198","PcsCompu_7d:12:f6","LLDP_Multicast","LLDP","158","LA/desktop-46lsrhc LA/port-001 20 SysN=DESKTOP-46LSRHC SysD=innotek GmbH VirtualBox,1.2,0 RTClass3 Port Status = OFF"
"18","0.177213","192.168.5.93","192.168.5.101","UDP","953","3389  >  51844 Len=911"
"19","0.177476","192.168.5.93","192.168.5.101","UDP","953","3389  >  51844 Len=911"
"20","0.197961","192.168.5.62","192.168.5.63","S7COMM","93","ROSCTR:[Job     ] Function:[Write Var]"
"21","0.197962","192.168.5.62","192.168.5.63","TCP","93","[TCP Retransmission] 59284  >  102 [PSH, ACK] Seq=110 Ack=74 Win=8192 Len=39"
"22","0.206476","192.168.5.63","192.168.5.62","S7COMM","76","ROSCTR:[Ack_Data] Function:[Write Var]"
"23","0.206477","192.168.5.63","192.168.5.62","TCP","76","[TCP Retransmission] 102  >  59284 [PSH, ACK] Seq=74 Ack=149 Win=8192 Len=22"
"24","0.224359","192.168.5.93","192.168.5.101","UDP","926","3389  >  51844 Len=884"
"25","0.224645","192.168.5.93","192.168.5.101","UDP","926","3389  >  51844 Len=884"
"26","0.235462","192.168.5.67","192.168.5.68","S7COMM-PLUS","123"," > 59899 Ver:[V3] [Notification] ObjId=DynObjX7.64.121 Ctick=160 NSeq=1108895 ChngCnt=1"
"27","0.235463","192.168.5.67","192.168.5.68","TCP","123","[TCP Retransmission] 102  >  59899 [PSH, ACK] Seq=1 Ack=1 Win=8192 Len=69"
"28","0.235463","192.168.5.68","192.168.5.67","TCP","60","59899  >  102 [ACK] Seq=1 Ack=70 Win=2920 Len=0"
"29","0.235463","192.168.5.68","192.168.5.67","TCP","60","[TCP Dup ACK 28#1] 59899  >  102 [ACK] Seq=1 Ack=70 Win=2920 Len=0"
"30","0.247023","192.168.5.68","192.168.5.67","S7COMM-PLUS","159","â†\22059899 Ver:[V3] Seq=56152 [Req SetVariable] ObjId=DynObjX7.64.121"
"31","0.247024","192.168.5.68","192.168.5.67","TCP","159","[TCP Retransmission] 59899  >  102 [PSH, ACK] Seq=1 Ack=70 Win=2920 Len=105"
"32","0.247856","192.168.5.62","192.168.5.63","S7COMM","85","ROSCTR:[Job     ] Function:[Read Var]"
"33","0.247857","192.168.5.62","192.168.5.63","TCP","85","[TCP Retransmission] 59284  >  102 [PSH, ACK] Seq=149 Ack=96 Win=8192 Len=31"
"34","0.250806","192.168.5.67","192.168.5.68","TCP","60","102  >  59899 [ACK] Seq=70 Ack=106 Win=8192 Len=0"
"35","0.250806","192.168.5.67","192.168.5.68","TCP","60","[TCP Dup ACK 34#1] 102  >  59899 [ACK] Seq=70 Ack=106 Win=8192 Len=0"
"36","0.256371","192.168.5.63","192.168.5.62","S7COMM","83","ROSCTR:[Ack_Data] Function:[Read Var]"
"37","0.256375","192.168.5.63","192.168.5.62","TCP","83","[TCP Retransmission] 102  >  59284 [PSH, ACK] Seq=96 Ack=180 Win=8192 Len=29"
"38","0.298756","192.168.5.62","192.168.5.63","S7COMM","93","ROSCTR:[Job     ] Function:[Write Var]"
"39","0.298761","192.168.5.62","192.168.5.63","TCP","93","[TCP Retransmission] 59284  >  102 [PSH, ACK] Seq=180 Ack=125 Win=8192 Len=39"
"40","0.305534","192.168.5.63","192.168.5.62","S7COMM","76","ROSCTR:[Ack_Data] Function:[Write Var]"
"41","0.305536","192.168.5.63","192.168.5.62","TCP","76","[TCP Retransmission] 102  >  59284 [PSH, ACK] Seq=125 Ack=219 Win=8192 Len=22"
"42","0.311319","Siemens_71:45:3c","LLDP_Multicast","PN-PTCP","60","DelayReq         , Seq=42108, Delay=          0ns, PortMAC=d4:f5:27:71:45:3c"
"43","0.311319","Siemens_71:45:3c","LLDP_Multicast","PN-PTCP","60","DelayReq         , Seq=42108, Delay=          0ns, PortMAC=d4:f5:27:71:45:3c"
"44","0.311320","Siemens_71:45:3c","LLDP_Multicast","PN-PTCP","60","DelayReq         , Seq=42108, Delay=          0ns, PortMAC=d4:f5:27:71:45:3c"
"45","0.334566","192.168.5.101","192.168.5.93","UDP","60","51844  >  3389 Len=11"
"46","0.334567","192.168.5.101","192.168.5.93","UDP","60","51844  >  3389 Len=11"
"47","0.398970","192.168.5.62","192.168.5.63","S7COMM","93","ROSCTR:[Job     ] Function:[Write Var]"
"48","0.398971","192.168.5.62","192.168.5.63","TCP","93","[TCP Retransmission] 59284  >  102 [PSH, ACK] Seq=219 Ack=147 Win=8192 Len=39"
"49","0.407402","192.168.5.63","192.168.5.62","S7COMM","76","ROSCTR:[Ack_Data] Function:[Write Var]"
"50","0.407404","192.168.5.63","192.168.5.62","TCP","76","[TCP Retransmission] 102  >  59284 [PSH, ACK] Seq=147 Ack=258 Win=8192 Len=22"
"51","0.448914","192.168.5.62","192.168.5.63","S7COMM","85","ROSCTR:[Job     ] Function:[Read Var]"
"52","0.448914","192.168.5.62","192.168.5.63","TCP","85","[TCP Retransmission] 59284  >  102 [PSH, ACK] Seq=258 Ack=169 Win=8192 Len=31"
"53","0.458793","192.168.5.63","192.168.5.62","S7COMM","83","ROSCTR:[Ack_Data] Function:[Read Var]"
"54","0.458808","192.168.5.63","192.168.5.62","TCP","83","[TCP Retransmission] 102  >  59284 [PSH, ACK] Seq=169 Ack=289 Win=8192 Len=29"
"55","0.476291","192.168.5.65","192.168.5.68","S7COMM-PLUS","123"," > 33491 Ver:[V3] [Notification] ObjId=DynObjX7.64.2 Ctick=164 NSeq=1108899 ChngCnt=1"
"56","0.476292","192.168.5.65","192.168.5.68","TCP","123","[TCP Retransmission] 102  >  33491 [PSH, ACK] Seq=1 Ack=1 Win=8192 Len=69"
"57","0.498922","192.168.5.62","192.168.5.63","S7COMM","93","ROSCTR:[Job     ] Function:[Write Var]"
"58","0.498923","192.168.5.62","192.168.5.63","TCP","93","[TCP Retransmission] 59284  >  102 [PSH, ACK] Seq=289 Ack=198 Win=8192 Len=39"
"59","0.507506","192.168.5.63","192.168.5.62","S7COMM","76","ROSCTR:[Ack_Data] Function:[Write Var]"
"60","0.507506","192.168.5.63","192.168.5.62","TCP","76","[TCP Retransmission] 102  >  59284 [PSH, ACK] Seq=198 Ack=328 Win=8192 Len=22"
"61","0.512875","192.168.5.68","192.168.5.65","TCP","60","33491  >  102 [ACK] Seq=1 Ack=70 Win=2920 Len=0"
"62","0.512876","192.168.5.68","192.168.5.65","TCP","60","[TCP Dup ACK 61#1] 33491  >  102 [ACK] Seq=1 Ack=70 Win=2920 Len=0"
"63","0.597957","192.168.5.62","192.168.5.63","S7COMM","93","ROSCTR:[Job     ] Function:[Write Var]"
"64","0.597958","192.168.5.62","192.168.5.63","TCP","93","[TCP Retransmission] 59284  >  102 [PSH, ACK] Seq=328 Ack=220 Win=8192 Len=39"
"65","0.606524","192.168.5.63","192.168.5.62","S7COMM","76","ROSCTR:[Ack_Data] Function:[Write Var]"
"66","0.606525","192.168.5.63","192.168.5.62","TCP","76","[TCP Retransmission] 102  >  59284 [PSH, ACK] Seq=220 Ack=367 Win=8192 Len=22"
"67","0.647959","192.168.5.62","192.168.5.63","S7COMM","85","ROSCTR:[Job     ] Function:[Read Var]"
"68","0.647961","192.168.5.62","192.168.5.63","TCP","85","[TCP Retransmission] 59284  >  102 [PSH, ACK] Seq=367 Ack=242 Win=8192 Len=31"
"69","0.654573","192.168.5.63","192.168.5.62","S7COMM","83","ROSCTR:[Ack_Data] Function:[Read Var]"
"70","0.654577","192.168.5.63","192.168.5.62","TCP","83","[TCP Retransmission] 102  >  59284 [PSH, ACK] Seq=242 Ack=398 Win=8192 Len=29"
"71","0.663356","192.168.5.64","192.168.5.68","S7COMM-PLUS","123"," > 43515 Ver:[V3] [Notification] ObjId=DynObjX7.64.119 Ctick=44 NSeq=407595 ChngCnt=1"
"72","0.663357","192.168.5.64","192.168.5.68","TCP","123","[TCP Retransmission] 102  >  43515 [PSH, ACK] Seq=1 Ack=1 Win=8192 Len=69"
"73","0.700941","192.168.5.62","192.168.5.63","S7COMM","93","ROSCTR:[Job     ] Function:[Write Var]"
"74","0.700948","192.168.5.62","192.168.5.63","TCP","93","[TCP Retransmission] 59284  >  102 [PSH, ACK] Seq=398 Ack=271 Win=8192 Len=39"
"75","0.701644","192.168.5.68","192.168.5.64","TCP","60","43515  >  102 [ACK] Seq=1 Ack=70 Win=2920 Len=0"
"76","0.701647","192.168.5.68","192.168.5.64","TCP","60","[TCP Dup ACK 75#1] 43515  >  102 [ACK] Seq=1 Ack=70 Win=2920 Len=0"
"77","0.707529","192.168.5.63","192.168.5.62","S7COMM","76","ROSCTR:[Ack_Data] Function:[Write Var]"
"78","0.707530","192.168.5.63","192.168.5.62","TCP","76","[TCP Retransmission] 102  >  59284 [PSH, ACK] Seq=271 Ack=437 Win=8192 Len=22"
"79","0.790950","192.168.5.67","192.168.5.68","S7COMM-PLUS","81"," > 59899 Ver:[Ext. Keep Alive] ConfirmedBytes=38974588"
"80","0.790955","192.168.5.67","192.168.5.68","TCP","81","[TCP Retransmission] 102  >  59899 [PSH, ACK] Seq=70 Ack=106 Win=8192 Len=27"
"81","0.798982","192.168.5.62","192.168.5.63","S7COMM","93","ROSCTR:[Job     ] Function:[Write Var]"
"82","0.798983","192.168.5.62","192.168.5.63","TCP","93","[TCP Retransmission] 59284  >  102 [PSH, ACK] Seq=437 Ack=293 Win=8192 Len=39"
"83","0.808501","192.168.5.63","192.168.5.62","S7COMM","76","ROSCTR:[Ack_Data] Function:[Write Var]"
"84","0.808502","192.168.5.63","192.168.5.62","TCP","76","[TCP Retransmission] 102  >  59284 [PSH, ACK] Seq=293 Ack=476 Win=8192 Len=22"
"85","0.828907","192.168.5.68","192.168.5.67","TCP","60","59899  >  102 [ACK] Seq=106 Ack=97 Win=2920 Len=0"
"86","0.828908","192.168.5.68","192.168.5.67","TCP","60","[TCP Dup ACK 85#1] 59899  >  102 [ACK] Seq=106 Ack=97 Win=2920 Len=0"
"87","0.836777","192.168.5.93","192.168.5.101","TLSv1.2","105","Application Data"
"88","0.837998","192.168.5.93","192.168.5.101","TCP","105","[TCP Retransmission] 3389  >  62762 [PSH, ACK] Seq=1 Ack=1 Win=63428 Len=51"
"89","0.841777","192.168.5.93","192.168.5.101","UDP","1279","3389  >  51844 Len=1237"
"90","0.841903","192.168.5.93","192.168.5.101","UDP","1279","3389  >  51844 Len=1237"
"91","0.842014","192.168.5.93","192.168.5.101","UDP","1279","3389  >  51844 Len=1237"
"92","0.842109","192.168.5.93","192.168.5.101","UDP","1279","3389  >  51844 Len=1237"
"93","0.842110","192.168.5.93","192.168.5.101","UDP","1279","3389  >  51844 Len=1237"
"94","0.842187","192.168.5.93","192.168.5.101","UDP","1279","3389  >  51844 Len=1237"
"95","0.842278","192.168.5.93","192.168.5.101","UDP","1279","3389  >  51844 Len=1237"
"96","0.842297","192.168.5.93","192.168.5.101","UDP","1282","3389  >  51844 Len=1240"
"97","0.842389","192.168.5.93","192.168.5.101","UDP","1279","3389  >  51844 Len=1237"
"98","0.842393","192.168.5.93","192.168.5.101","UDP","1279","3389  >  51844 Len=1237"
"99","0.842452","192.168.5.93","192.168.5.101","UDP","1279","3389  >  51844 Len=1237"
"100","0.842490","192.168.5.93","192.168.5.101","UDP","1282","3389  >  51844 Len=1240"
"101","0.842540","192.168.5.93","192.168.5.101","UDP","276","3389  >  51844 Len=234"
"102","0.842584","192.168.5.93","192.168.5.101","UDP","1279","3389  >  51844 Len=1237"
"103","0.842701","192.168.5.93","192.168.5.101","UDP","1279","3389  >  51844 Len=1237"
"104","0.842702","192.168.5.93","192.168.5.101","UDP","276","3389  >  51844 Len=234"
"105","0.848919","192.168.5.62","192.168.5.63","S7COMM","85","ROSCTR:[Job     ] Function:[Read Var]"
"106","0.848920","192.168.5.62","192.168.5.63","TCP","85","[TCP Retransmission] 59284  >  102 [PSH, ACK] Seq=476 Ack=315 Win=8192 Len=31"
"107","0.856459","192.168.5.101","192.168.5.93","UDP","238","51844  >  3389 Len=196"
"108","0.856459","192.168.5.101","192.168.5.93","UDP","238","51844  >  3389 Len=196"
"109","0.856460","192.168.5.63","192.168.5.62","S7COMM","83","ROSCTR:[Ack_Data] Function:[Read Var]"
"110","0.856460","192.168.5.63","192.168.5.62","TCP","83","[TCP Retransmission] 102  >  59284 [PSH, ACK] Seq=315 Ack=507 Win=8192 Len=29"
"111","0.867603","192.168.5.93","192.168.5.101","UDP","53","3389  >  51844 Len=11"
"112","0.867673","192.168.5.93","192.168.5.101","UDP","52","3389  >  51844 Len=10"
"113","0.867875","192.168.5.93","192.168.5.101","UDP","60","3389  >  51844 Len=11"
"114","0.867876","192.168.5.93","192.168.5.101","UDP","60","3389  >  51844 Len=10"
"115","0.884885","192.168.5.101","192.168.5.93","TCP","60","62762  >  3389 [ACK] Seq=1 Ack=52 Win=8211 Len=0"
"116","0.884886","192.168.5.101","192.168.5.93","TCP","60","[TCP Dup ACK 115#1] 62762  >  3389 [ACK] Seq=1 Ack=52 Win=8211 Len=0"
"117","0.895763","192.168.5.93","192.168.5.101","UDP","1279","3389  >  51844 Len=1237"
"118","0.896017","192.168.5.93","192.168.5.101","UDP","1279","3389  >  51844 Len=1237"
"119","0.896033","192.168.5.93","192.168.5.101","UDP","1279","3389  >  51844 Len=1237"
"120","0.896095","192.168.5.93","192.168.5.101","UDP","1279","3389  >  51844 Len=1237"
"121","0.896141","192.168.5.93","192.168.5.101","UDP","1279","3389  >  51844 Len=1237"
"122","0.896147","192.168.5.93","192.168.5.101","UDP","1279","3389  >  51844 Len=1237"
"123","0.896245","192.168.5.93","192.168.5.101","UDP","1279","3389  >  51844 Len=1237"
"124","0.896246","192.168.5.93","192.168.5.101","UDP","1279","3389  >  51844 Len=1237"
"125","0.896312","192.168.5.93","192.168.5.101","UDP","257","3389  >  51844 Len=215"
"126","0.896708","192.168.5.93","192.168.5.101","UDP","257","3389  >  51844 Len=215"
"127","0.897904","192.168.5.62","192.168.5.63","S7COMM","93","ROSCTR:[Job     ] Function:[Write Var]"
"128","0.897904","192.168.5.62","192.168.5.63","TCP","93","[TCP Retransmission] 59284  >  102 [PSH, ACK] Seq=507 Ack=344 Win=8192 Len=39"
"129","0.907859","192.168.5.63","192.168.5.62","S7COMM","76","ROSCTR:[Ack_Data] Function:[Write Var]"
"130","0.907864","192.168.5.63","192.168.5.62","TCP","76","[TCP Retransmission] 102  >  59284 [PSH, ACK] Seq=344 Ack=546 Win=8192 Len=22"
"131","0.997928","192.168.5.62","192.168.5.63","S7COMM","93","ROSCTR:[Job     ] Function:[Write Var]"
"132","0.997929","192.168.5.62","192.168.5.63","TCP","93","[TCP Retransmission] 59284  >  102 [PSH, ACK] Seq=546 Ack=366 Win=8192 Len=39"
"133","1.005582","192.168.5.63","192.168.5.62","S7COMM","76","ROSCTR:[Ack_Data] Function:[Write Var]"
"134","1.005583","192.168.5.63","192.168.5.62","TCP","76","[TCP Retransmission] 102  >  59284 [PSH, ACK] Seq=366 Ack=585 Win=8192 Len=22"
"135","1.050055","192.168.5.62","192.168.5.63","S7COMM","85","ROSCTR:[Job     ] Function:[Read Var]"
"136","1.050057","192.168.5.62","192.168.5.63","TCP","85","[TCP Retransmission] 59284  >  102 [PSH, ACK] Seq=585 Ack=388 Win=8192 Len=31"
"137","1.057443","192.168.5.101","192.168.5.93","UDP","60","51844  >  3389 Len=14"
"138","1.057445","192.168.5.101","192.168.5.93","UDP","60","51844  >  3389 Len=14"
"139","1.058555","192.168.5.63","192.168.5.62","S7COMM","83","ROSCTR:[Ack_Data] Function:[Read Var]"
"140","1.058556","192.168.5.63","192.168.5.62","TCP","83","[TCP Retransmission] 102  >  59284 [PSH, ACK] Seq=388 Ack=616 Win=8192 Len=29"
"141","1.069059","192.168.5.66","192.168.5.68","S7COMM-PLUS","123"," > 54765 Ver:[V3] [Notification] ObjId=DynObjX7.64.2 Ctick=162 NSeq=1108897 ChngCnt=1"
"142","1.069060","192.168.5.66","192.168.5.68","TCP","123","[TCP Retransmission] 102  >  54765 [PSH, ACK] Seq=70 Ack=1 Win=8192 Len=69"
"143","1.069312","192.168.5.68","192.168.5.66","TCP","60","54765  >  102 [ACK] Seq=1 Ack=139 Win=2920 Len=0"
"144","1.069313","192.168.5.68","192.168.5.66","TCP","60","[TCP Dup ACK 143#1] 54765  >  102 [ACK] Seq=1 Ack=139 Win=2920 Len=0"
"145","1.098959","192.168.5.62","192.168.5.63","S7COMM","93","ROSCTR:[Job     ] Function:[Write Var]"
"146","1.098960","192.168.5.62","192.168.5.63","TCP","93","[TCP Retransmission] 59284  >  102 [PSH, ACK] Seq=616 Ack=417 Win=8192 Len=39"
"147","1.107929","192.168.5.63","192.168.5.62","S7COMM","76","ROSCTR:[Ack_Data] Function:[Write Var]"
"148","1.107939","192.168.5.63","192.168.5.62","TCP","76","[TCP Retransmission] 102  >  59284 [PSH, ACK] Seq=417 Ack=655 Win=8192 Len=22"
"149","1.122382","192.168.5.64","192.168.5.68","S7COMM-PLUS","81"," > 43515 Ver:[Ext. Keep Alive] ConfirmedBytes=14335647"
"150","1.122383","192.168.5.64","192.168.5.68","TCP","81","[TCP Retransmission] 102  >  43515 [PSH, ACK] Seq=70 Ack=1 Win=8192 Len=27"
"151","1.122712","192.168.5.68","192.168.5.64","TCP","60","43515  >  102 [ACK] Seq=1 Ack=97 Win=2920 Len=0"
"152","1.122713","192.168.5.68","192.168.5.64","TCP","60","[TCP Dup ACK 151#1] 43515  >  102 [ACK] Seq=1 Ack=97 Win=2920 Len=0"
"153","1.199591","192.168.5.62","192.168.5.63","S7COMM","93","ROSCTR:[Job     ] Function:[Write Var]"
"154","1.199594","192.168.5.62","192.168.5.63","TCP","93","[TCP Retransmission] 59284  >  102 [PSH, ACK] Seq=655 Ack=439 Win=8192 Len=39"
"155","1.207610","192.168.5.63","192.168.5.62","S7COMM","76","ROSCTR:[Ack_Data] Function:[Write Var]"
"156","1.207611","192.168.5.63","192.168.5.62","TCP","76","[TCP Retransmission] 102  >  59284 [PSH, ACK] Seq=439 Ack=694 Win=8192 Len=22"
"157","1.234939","192.168.5.67","192.168.5.68","S7COMM-PLUS","123"," > 59899 Ver:[V3] [Notification] ObjId=DynObjX7.64.121 Ctick=161 NSeq=1108896 ChngCnt=1"
"158","1.234941","192.168.5.67","192.168.5.68","TCP","123","[TCP Retransmission] 102  >  59899 [PSH, ACK] Seq=97 Ack=106 Win=8192 Len=69"
"159","1.235165","192.168.5.68","192.168.5.67","TCP","60","59899  >  102 [ACK] Seq=106 Ack=166 Win=2920 Len=0"
"160","1.235165","192.168.5.68","192.168.5.67","TCP","60","[TCP Dup ACK 159#1] 59899  >  102 [ACK] Seq=106 Ack=166 Win=2920 Len=0"
"161","1.248052","192.168.5.62","192.168.5.63","S7COMM","85","ROSCTR:[Job     ] Function:[Read Var]"
"162","1.248053","192.168.5.62","192.168.5.63","TCP","85","[TCP Retransmission] 59284  >  102 [PSH, ACK] Seq=694 Ack=461 Win=8192 Len=31"
"163","1.255625","192.168.5.63","192.168.5.62","S7COMM","83","ROSCTR:[Ack_Data] Function:[Read Var]"
"164","1.255626","192.168.5.63","192.168.5.62","TCP","83","[TCP Retransmission] 102  >  59284 [PSH, ACK] Seq=461 Ack=725 Win=8192 Len=29"
"165","1.298039","192.168.5.62","192.168.5.63","S7COMM","93","ROSCTR:[Job     ] Function:[Write Var]"
"166","1.298040","192.168.5.62","192.168.5.63","TCP","93","[TCP Retransmission] 59284  >  102 [PSH, ACK] Seq=725 Ack=490 Win=8192 Len=39"
"167","1.306539","192.168.5.63","192.168.5.62","S7COMM","76","ROSCTR:[Ack_Data] Function:[Write Var]"
"168","1.306540","192.168.5.63","192.168.5.62","TCP","76","[TCP Retransmission] 102  >  59284 [PSH, ACK] Seq=490 Ack=764 Win=8192 Len=22"
"169","1.401754","192.168.5.62","192.168.5.63","S7COMM","93","ROSCTR:[Job     ] Function:[Write Var]"
"170","1.401762","192.168.5.62","192.168.5.63","TCP","93","[TCP Retransmission] 59284  >  102 [PSH, ACK] Seq=764 Ack=512 Win=8192 Len=39"
"171","1.407534","192.168.5.63","192.168.5.62","S7COMM","76","ROSCTR:[Ack_Data] Function:[Write Var]"
"172","1.407535","192.168.5.63","192.168.5.62","TCP","76","[TCP Retransmission] 102  >  59284 [PSH, ACK] Seq=512 Ack=803 Win=8192 Len=22"
"173","1.424891","Netgear_11:52:b3","All-RBridges","Slow Protocols","60","Subtype = 136"
"174","1.424899","Netgear_11:52:b3","All-RBridges","Slow Protocols","60","Subtype = 136"
"175","1.425558","Netgear_11:52:b3","All-RBridges","Slow Protocols","60","Subtype = 136"
"176","1.425559","Netgear_11:52:b3","All-RBridges","Slow Protocols","60","Subtype = 136"
"177","1.425559","Netgear_11:52:b3","All-RBridges","Slow Protocols","60","Subtype = 136"
"178","1.425560","Netgear_11:52:b3","All-RBridges","Slow Protocols","60","Subtype = 136"
"179","1.425633","Netgear_11:52:b3","All-RBridges","Slow Protocols","60","Subtype = 136"
"180","1.425803","Netgear_11:52:b3","All-RBridges","Slow Protocols","60","Subtype = 136"
"181","1.425952","Netgear_11:52:b3","All-RBridges","Slow Protocols","60","Subtype = 136"
"182","1.426100","Netgear_11:52:b3","All-RBridges","Slow Protocols","60","Subtype = 136"
"183","1.426382","Netgear_11:52:b3","All-RBridges","Slow Protocols","60","Subtype = 136"
"184","1.426534","Netgear_11:52:b3","All-RBridges","Slow Protocols","60","Subtype = 136"
"185","1.426675","Netgear_11:52:b3","All-RBridges","Slow Protocols","60","Subtype = 136"
"186","1.426820","Netgear_11:52:b3","All-RBridges","Slow Protocols","60","Subtype = 136"
"187","1.426993","Netgear_11:52:b3","All-RBridges","Slow Protocols","60","Subtype = 136"
"188","1.427283","Netgear_11:52:b3","All-RBridges","Slow Protocols","60","Subtype = 136"
"189","1.448948","192.168.5.62","192.168.5.63","S7COMM","85","ROSCTR:[Job     ] Function:[Read Var]"
"190","1.448949","192.168.5.62","192.168.5.63","TCP","85","[TCP Retransmission] 59284  >  102 [PSH, ACK] Seq=803 Ack=534 Win=8192 Len=31"
"191","1.455571","192.168.5.63","192.168.5.62","S7COMM","83","ROSCTR:[Ack_Data] Function:[Read Var]"
"192","1.455572","192.168.5.63","192.168.5.62","TCP","83","[TCP Retransmission] 102  >  59284 [PSH, ACK] Seq=534 Ack=834 Win=8192 Len=29"
"193","1.476298","192.168.5.65","192.168.5.68","S7COMM-PLUS","123"," > 33491 Ver:[V3] [Notification] ObjId=DynObjX7.64.2 Ctick=165 NSeq=1108900 ChngCnt=1"
"194","1.476299","192.168.5.65","192.168.5.68","TCP","123","[TCP Retransmission] 102  >  33491 [PSH, ACK] Seq=70 Ack=1 Win=8192 Len=69"
"195","1.476550","192.168.5.68","192.168.5.65","TCP","60","33491  >  102 [ACK] Seq=1 Ack=139 Win=2920 Len=0"
"196","1.476551","192.168.5.68","192.168.5.65","TCP","60","[TCP Dup ACK 195#1] 33491  >  102 [ACK] Seq=1 Ack=139 Win=2920 Len=0"
"197","1.498920","192.168.5.62","192.168.5.63","S7COMM","93","ROSCTR:[Job     ] Function:[Write Var]"
"198","1.498921","192.168.5.62","192.168.5.63","TCP","93","[TCP Retransmission] 59284  >  102 [PSH, ACK] Seq=834 Ack=563 Win=8192 Len=39"
"199","1.508551","192.168.5.63","192.168.5.62","S7COMM","76","ROSCTR:[Ack_Data] Function:[Write Var]"
"200","1.508552","192.168.5.63","192.168.5.62","TCP","76","[TCP Retransmission] 102  >  59284 [PSH, ACK] Seq=563 Ack=873 Win=8192 Len=22"
"201","1.512498","Siemens_71:45:3c","LLDP_Multicast","PN-PTCP","60","DelayReq         , Seq=42109, Delay=          0ns, PortMAC=d4:f5:27:71:45:3c"
"202","1.512499","Siemens_71:45:3c","LLDP_Multicast","PN-PTCP","60","DelayReq         , Seq=42109, Delay=          0ns, PortMAC=d4:f5:27:71:45:3c"
"203","1.512499","Siemens_71:45:3c","LLDP_Multicast","PN-PTCP","60","DelayReq         , Seq=42109, Delay=          0ns, PortMAC=d4:f5:27:71:45:3c"
"204","1.597964","192.168.5.62","192.168.5.63","S7COMM","93","ROSCTR:[Job     ] Function:[Write Var]"
"205","1.597965","192.168.5.62","192.168.5.63","TCP","93","[TCP Retransmission] 59284  >  102 [PSH, ACK] Seq=873 Ack=585 Win=8192 Len=39"
"206","1.604602","192.168.5.63","192.168.5.62","S7COMM","76","ROSCTR:[Ack_Data] Function:[Write Var]"
"207","1.604603","192.168.5.63","192.168.5.62","TCP","76","[TCP Retransmission] 102  >  59284 [PSH, ACK] Seq=585 Ack=912 Win=8192 Len=22"
"208","1.648032","192.168.5.62","192.168.5.63","S7COMM","85","ROSCTR:[Job     ] Function:[Read Var]"
"209","1.648034","192.168.5.62","192.168.5.63","TCP","85","[TCP Retransmission] 59284  >  102 [PSH, ACK] Seq=912 Ack=607 Win=8192 Len=31"
"210","1.657639","192.168.5.63","192.168.5.62","S7COMM","83","ROSCTR:[Ack_Data] Function:[Read Var]"
"211","1.657641","192.168.5.63","192.168.5.62","TCP","83","[TCP Retransmission] 102  >  59284 [PSH, ACK] Seq=607 Ack=943 Win=8192 Len=29"
"212","1.663399","192.168.5.64","192.168.5.68","S7COMM-PLUS","123"," > 43515 Ver:[V3] [Notification] ObjId=DynObjX7.64.119 Ctick=45 NSeq=407596 ChngCnt=1"
"213","1.663400","192.168.5.64","192.168.5.68","TCP","123","[TCP Retransmission] 102  >  43515 [PSH, ACK] Seq=97 Ack=1 Win=8192 Len=69"
"214","1.663707","192.168.5.68","192.168.5.64","TCP","60","43515  >  102 [ACK] Seq=1 Ack=166 Win=2920 Len=0"
"215","1.663708","192.168.5.68","192.168.5.64","TCP","60","[TCP Dup ACK 214#1] 43515  >  102 [ACK] Seq=1 Ack=166 Win=2920 Len=0"
"216","1.685664","192.168.5.93","192.168.5.101","UDP","1279","3389  >  51844 Len=1237"
"217","1.685734","192.168.5.93","192.168.5.101","UDP","1279","3389  >  51844 Len=1237"
"218","1.685777","192.168.5.93","192.168.5.101","UDP","1279","3389  >  51844 Len=1237"
"219","1.685871","192.168.5.93","192.168.5.101","UDP","1279","3389  >  51844 Len=1237"
"220","1.685947","192.168.5.93","192.168.5.101","UDP","1279","3389  >  51844 Len=1237"
"221","1.685958","192.168.5.93","192.168.5.101","UDP","1279","3389  >  51844 Len=1237"
"222","1.685959","192.168.5.93","192.168.5.101","UDP","1279","3389  >  51844 Len=1237"
"223","1.685959","192.168.5.93","192.168.5.101","UDP","1279","3389  >  51844 Len=1237"
"224","1.685988","192.168.5.93","192.168.5.101","UDP","1282","3389  >  51844 Len=1240"
"225","1.686033","192.168.5.93","192.168.5.101","UDP","1279","3389  >  51844 Len=1237"
"226","1.686053","192.168.5.93","192.168.5.101","UDP","1279","3389  >  51844 Len=1237"
"227","1.686054","192.168.5.93","192.168.5.101","UDP","1279","3389  >  51844 Len=1237"
"228","1.686070","192.168.5.93","192.168.5.101","UDP","1279","3389  >  51844 Len=1237"
"229","1.686135","192.168.5.93","192.168.5.101","UDP","1279","3389  >  51844 Len=1237"
"230","1.686175","192.168.5.93","192.168.5.101","UDP","1279","3389  >  51844 Len=1237"
"231","1.686239","192.168.5.93","192.168.5.101","UDP","1282","3389  >  51844 Len=1240"
"232","1.686240","192.168.5.93","192.168.5.101","UDP","1279","3389  >  51844 Len=1237"
"233","1.686258","192.168.5.93","192.168.5.101","UDP","1279","3389  >  51844 Len=1237"
"234","1.686300","192.168.5.93","192.168.5.101","UDP","1279","3389  >  51844 Len=1237"
"235","1.686344","192.168.5.93","192.168.5.101","UDP","1279","3389  >  51844 Len=1237"
"236","1.686345","192.168.5.93","192.168.5.101","UDP","1279","3389  >  51844 Len=1237"
"237","1.686403","192.168.5.93","192.168.5.101","UDP","1279","3389  >  51844 Len=1237"
"238","1.686445","192.168.5.93","192.168.5.101","UDP","1279","3389  >  51844 Len=1237"
"239","1.686446","192.168.5.93","192.168.5.101","UDP","1279","3389  >  51844 Len=1237"
"240","1.686447","192.168.5.93","192.168.5.101","UDP","1279","3389  >  51844 Len=1237"
"241","1.686448","192.168.5.93","192.168.5.101","UDP","1279","3389  >  51844 Len=1237"
"242","1.686479","192.168.5.93","192.168.5.101","UDP","1279","3389  >  51844 Len=1237"
"243","1.686528","192.168.5.93","192.168.5.101","UDP","1279","3389  >  51844 Len=1237"
"244","1.686581","192.168.5.93","192.168.5.101","UDP","1279","3389  >  51844 Len=1237"
"245","1.686582","192.168.5.93","192.168.5.101","UDP","1279","3389  >  51844 Len=1237"
"246","1.686628","192.168.5.93","192.168.5.101","UDP","1279","3389  >  51844 Len=1237"
"247","1.686671","192.168.5.93","192.168.5.101","UDP","1279","3389  >  51844 Len=1237"
"248","1.686700","192.168.5.93","192.168.5.101","UDP","1279","3389  >  51844 Len=1237"
"249","1.686701","192.168.5.93","192.168.5.101","UDP","1279","3389  >  51844 Len=1237"
"250","1.686788","192.168.5.93","192.168.5.101","UDP","1279","3389  >  51844 Len=1237"
"251","1.686838","192.168.5.93","192.168.5.101","UDP","1279","3389  >  51844 Len=1237"
"252","1.686839","192.168.5.93","192.168.5.101","UDP","1279","3389  >  51844 Len=1237"
"253","1.686898","192.168.5.93","192.168.5.101","UDP","1279","3389  >  51844 Len=1237"
"254","1.686939","192.168.5.93","192.168.5.101","UDP","1279","3389  >  51844 Len=1237"
"255","1.686951","192.168.5.93","192.168.5.101","UDP","1279","3389  >  51844 Len=1237"
"256","1.686972","192.168.5.93","192.168.5.101","UDP","56","3389  >  51844 Len=14"
"257","1.687086","192.168.5.93","192.168.5.101","UDP","1279","3389  >  51844 Len=1237"
"258","1.687087","192.168.5.93","192.168.5.101","UDP","1279","3389  >  51844 Len=1237"
"259","1.687088","192.168.5.93","192.168.5.101","UDP","60","3389  >  51844 Len=14"
"260","1.700019","192.168.5.62","192.168.5.63","S7COMM","93","ROSCTR:[Job     ] Function:[Write Var]"
"261","1.700020","192.168.5.62","192.168.5.63","TCP","93","[TCP Retransmission] 59284  >  102 [PSH, ACK] Seq=943 Ack=636 Win=8192 Len=39"
"262","1.707576","192.168.5.63","192.168.5.62","S7COMM","76","ROSCTR:[Ack_Data] Function:[Write Var]"
"263","1.707577","192.168.5.63","192.168.5.62","TCP","76","[TCP Retransmission] 102  >  59284 [PSH, ACK] Seq=636 Ack=982 Win=8192 Len=22"
"264","1.799089","192.168.5.62","192.168.5.63","S7COMM","93","ROSCTR:[Job     ] Function:[Write Var]"
"265","1.799090","192.168.5.62","192.168.5.63","TCP","93","[TCP Retransmission] 59284  >  102 [PSH, ACK] Seq=982 Ack=658 Win=8192 Len=39"
"266","1.806590","192.168.5.63","192.168.5.62","S7COMM","76","ROSCTR:[Ack_Data] Function:[Write Var]"
"267","1.806591","192.168.5.63","192.168.5.62","TCP","76","[TCP Retransmission] 102  >  59284 [PSH, ACK] Seq=658 Ack=1021 Win=8192 Len=22"
"268","1.844518","192.168.5.101","192.168.5.93","UDP","68","51844  >  3389 Len=26"
"269","1.844520","192.168.5.101","192.168.5.93","UDP","68","51844  >  3389 Len=26"
"270","1.849006","192.168.5.62","192.168.5.63","S7COMM","85","ROSCTR:[Job     ] Function:[Read Var]"
"271","1.849008","192.168.5.62","192.168.5.63","TCP","85","[TCP Retransmission] 59284  >  102 [PSH, ACK] Seq=1021 Ack=680 Win=8192 Len=31"
"272","1.856553","192.168.5.63","192.168.5.62","S7COMM","83","ROSCTR:[Ack_Data] Function:[Read Var]"
"273","1.856554","192.168.5.63","192.168.5.62","TCP","83","[TCP Retransmission] 102  >  59284 [PSH, ACK] Seq=680 Ack=1052 Win=8192 Len=29"
"274","1.898114","192.168.5.62","192.168.5.63","S7COMM","93","ROSCTR:[Job     ] Function:[Write Var]"
"275","1.898115","192.168.5.62","192.168.5.63","TCP","93","[TCP Retransmission] 59284  >  102 [PSH, ACK] Seq=1052 Ack=709 Win=8192 Len=39"
"276","1.905599","192.168.5.63","192.168.5.62","S7COMM","76","ROSCTR:[Ack_Data] Function:[Write Var]"
"277","1.905600","192.168.5.63","192.168.5.62","TCP","76","[TCP Retransmission] 102  >  59284 [PSH, ACK] Seq=709 Ack=1091 Win=8192 Len=22"
"278","1.997304","192.168.5.65","192.168.5.68","S7COMM-PLUS","81"," > 33491 Ver:[Ext. Keep Alive] ConfirmedBytes=39141717"
"279","1.997306","192.168.5.65","192.168.5.68","TCP","81","[TCP Retransmission] 102  >  33491 [PSH, ACK] Seq=139 Ack=1 Win=8192 Len=27"
"280","1.997615","192.168.5.68","192.168.5.65","TCP","60","33491  >  102 [ACK] Seq=1 Ack=166 Win=2920 Len=0"
"281","1.997616","192.168.5.68","192.168.5.65","TCP","60","[TCP Dup ACK 280#1] 33491  >  102 [ACK] Seq=1 Ack=166 Win=2920 Len=0"
"282","1.998760","192.168.5.62","192.168.5.63","S7COMM","93","ROSCTR:[Job     ] Function:[Write Var]"
"283","1.998769","192.168.5.62","192.168.5.63","TCP","93","[TCP Retransmission] 59284  >  102 [PSH, ACK] Seq=1091 Ack=731 Win=8192 Len=39"
"284","2.003548","192.168.5.63","192.168.5.62","S7COMM","76","ROSCTR:[Ack_Data] Function:[Write Var]"
"285","2.003549","192.168.5.63","192.168.5.62","TCP","76","[TCP Retransmission] 102  >  59284 [PSH, ACK] Seq=731 Ack=1130 Win=8192 Len=22"
"286","2.013824","192.168.5.93","192.168.5.101","TLSv1.2","105","Application Data"
"287","2.014008","192.168.5.93","192.168.5.101","TCP","105","[TCP Retransmission] 3389  >  62762 [PSH, ACK] Seq=52 Ack=1 Win=63428 Len=51"
"288","2.014210","192.168.5.93","192.168.5.101","UDP","969","3389  >  51844 Len=927"
"289","2.014362","192.168.5.93","192.168.5.101","UDP","969","3389  >  51844 Len=927"
"290","2.023324","192.168.5.101","192.168.5.93","UDP","152","51844  >  3389 Len=110"
"291","2.023324","192.168.5.101","192.168.5.93","UDP","152","51844  >  3389 Len=110"
"292","2.034888","192.168.5.93","192.168.5.101","UDP","53","3389  >  51844 Len=11"
"293","2.034971","192.168.5.93","192.168.5.101","UDP","52","3389  >  51844 Len=10"
"294","2.035070","192.168.5.93","192.168.5.101","UDP","60","3389  >  51844 Len=11"
"295","2.035071","192.168.5.93","192.168.5.101","UDP","60","3389  >  51844 Len=10"
"296","2.050004","192.168.5.62","192.168.5.63","S7COMM","85","ROSCTR:[Job     ] Function:[Read Var]"
"297","2.050005","192.168.5.62","192.168.5.63","TCP","85","[TCP Retransmission] 59284  >  102 [PSH, ACK] Seq=1130 Ack=753 Win=8192 Len=31"
"298","2.056416","192.168.5.93","192.168.5.101","UDP","1140","3389  >  51844 Len=1098"
"299","2.056715","192.168.5.93","192.168.5.101","UDP","1140","3389  >  51844 Len=1098"
"300","2.058523","192.168.5.63","192.168.5.62","S7COMM","83","ROSCTR:[Ack_Data] Function:[Read Var]"
"301","2.058524","192.168.5.63","192.168.5.62","TCP","83","[TCP Retransmission] 102  >  59284 [PSH, ACK] Seq=753 Ack=1161 Win=8192 Len=29"
"302","2.064647","192.168.5.101","192.168.5.93","TCP","60","62762  >  3389 [ACK] Seq=1 Ack=103 Win=8211 Len=0"
"303","2.064667","192.168.5.101","192.168.5.93","TCP","60","[TCP Dup ACK 302#1] 62762  >  3389 [ACK] Seq=1 Ack=103 Win=8211 Len=0"
"304","2.069024","192.168.5.66","192.168.5.68","S7COMM-PLUS","123"," > 54765 Ver:[V3] [Notification] ObjId=DynObjX7.64.2 Ctick=163 NSeq=1108898 ChngCnt=1"
"305","2.069025","192.168.5.66","192.168.5.68","TCP","123","[TCP Retransmission] 102  >  54765 [PSH, ACK] Seq=139 Ack=1 Win=8192 Len=69"
"306","2.069358","192.168.5.68","192.168.5.66","TCP","60","54765  >  102 [ACK] Seq=1 Ack=208 Win=2920 Len=0"
"307","2.069359","192.168.5.68","192.168.5.66","TCP","60","[TCP Dup ACK 306#1] 54765  >  102 [ACK] Seq=1 Ack=208 Win=2920 Len=0"
"308","2.078836","192.168.5.68","192.168.5.66","S7COMM-PLUS","159","â†\22054765 Ver:[V3] Seq=56164 [Req SetVariable] ObjId=DynObjX7.64.2"
"309","2.078837","192.168.5.68","192.168.5.66","TCP","159","[TCP Retransmission] 54765  >  102 [PSH, ACK] Seq=1 Ack=208 Win=2920 Len=105"
"310","2.091935","192.168.5.93","192.168.5.101","UDP","1279","3389  >  51844 Len=1237"
"311","2.092104","192.168.5.93","192.168.5.101","UDP","1279","3389  >  51844 Len=1237"
"312","2.092190","192.168.5.93","192.168.5.101","UDP","1279","3389  >  51844 Len=1237"
"313","2.092255","192.168.5.93","192.168.5.101","UDP","211","3389  >  51844 Len=169"
"314","2.092332","192.168.5.93","192.168.5.101","UDP","1279","3389  >  51844 Len=1237"
"315","2.092335","192.168.5.93","192.168.5.101","UDP","211","3389  >  51844 Len=169"
"316","2.099138","192.168.5.62","192.168.5.63","S7COMM","93","ROSCTR:[Job     ] Function:[Write Var]"
"317","2.099139","192.168.5.62","192.168.5.63","TCP","93","[TCP Retransmission] 59284  >  102 [PSH, ACK] Seq=1161 Ack=782 Win=8192 Len=39"
"318","2.103191","192.168.5.93","192.168.5.101","UDP","94","3389  >  51844 Len=52"
"319","2.103463","192.168.5.93","192.168.5.101","UDP","94","3389  >  51844 Len=52"
"320","2.107257","192.168.5.63","192.168.5.62","S7COMM","76","ROSCTR:[Ack_Data] Function:[Write Var]"
"321","2.107264","192.168.5.63","192.168.5.62","TCP","76","[TCP Retransmission] 102  >  59284 [PSH, ACK] Seq=782 Ack=1200 Win=8192 Len=22"
"322","2.184546","192.168.5.101","192.168.5.93","UDP","60","51844  >  3389 Len=14"
"323","2.184548","192.168.5.101","192.168.5.93","UDP","60","51844  >  3389 Len=14"
"324","2.198108","192.168.5.62","192.168.5.63","S7COMM","93","ROSCTR:[Job     ] Function:[Write Var]"
"325","2.198109","192.168.5.66","192.168.5.68","TCP","60","102  >  54765 [ACK] Seq=208 Ack=106 Win=8192 Len=0"
"326","2.198110","192.168.5.62","192.168.5.63","TCP","93","[TCP Retransmission] 59284  >  102 [PSH, ACK] Seq=1200 Ack=804 Win=8192 Len=39"
"327","2.198111","192.168.5.66","192.168.5.68","TCP","60","[TCP Dup ACK 325#1] 102  >  54765 [ACK] Seq=208 Ack=106 Win=8192 Len=0"
"328","2.205630","192.168.5.63","192.168.5.62","S7COMM","76","ROSCTR:[Ack_Data] Function:[Write Var]"
"329","2.205631","192.168.5.63","192.168.5.62","TCP","76","[TCP Retransmission] 102  >  59284 [PSH, ACK] Seq=804 Ack=1239 Win=8192 Len=22"
"330","2.234961","192.168.5.67","192.168.5.68","S7COMM-PLUS","123"," > 59899 Ver:[V3] [Notification] ObjId=DynObjX7.64.121 Ctick=162 NSeq=1108897 ChngCnt=1"
"331","2.234963","192.168.5.67","192.168.5.68","TCP","123","[TCP Retransmission] 102  >  59899 [PSH, ACK] Seq=166 Ack=106 Win=8192 Len=69"
"332","2.235127","192.168.5.68","192.168.5.67","TCP","60","59899  >  102 [ACK] Seq=106 Ack=235 Win=2920 Len=0"
"333","2.235128","192.168.5.68","192.168.5.67","TCP","60","[TCP Dup ACK 332#1] 59899  >  102 [ACK] Seq=106 Ack=235 Win=2920 Len=0"
"334","2.248038","192.168.5.62","192.168.5.63","S7COMM","85","ROSCTR:[Job     ] Function:[Read Var]"
"335","2.248039","192.168.5.62","192.168.5.63","TCP","85","[TCP Retransmission] 59284  >  102 [PSH, ACK] Seq=1239 Ack=826 Win=8192 Len=31"
"336","2.256584","192.168.5.63","192.168.5.62","S7COMM","83","ROSCTR:[Ack_Data] Function:[Read Var]"
"337","2.256585","192.168.5.63","192.168.5.62","TCP","83","[TCP Retransmission] 102  >  59284 [PSH, ACK] Seq=826 Ack=1270 Win=8192 Len=29"
"338","2.298008","192.168.5.62","192.168.5.63","S7COMM","93","ROSCTR:[Job     ] Function:[Write Var]"
"339","2.298009","192.168.5.62","192.168.5.63","TCP","93","[TCP Retransmission] 59284  >  102 [PSH, ACK] Seq=1270 Ack=855 Win=8192 Len=39"
"340","2.305488","192.168.5.63","192.168.5.62","S7COMM","76","ROSCTR:[Ack_Data] Function:[Write Var]"
"341","2.305489","192.168.5.63","192.168.5.62","TCP","76","[TCP Retransmission] 102  >  59284 [PSH, ACK] Seq=855 Ack=1309 Win=8192 Len=22"
"342","2.399032","192.168.5.62","192.168.5.63","S7COMM","93","ROSCTR:[Job     ] Function:[Write Var]"
"343","2.399033","192.168.5.62","192.168.5.63","TCP","93","[TCP Retransmission] 59284  >  102 [PSH, ACK] Seq=1309 Ack=877 Win=8192 Len=39"
"344","2.408674","192.168.5.63","192.168.5.62","S7COMM","76","ROSCTR:[Ack_Data] Function:[Write Var]"
"345","2.408676","192.168.5.63","192.168.5.62","TCP","76","[TCP Retransmission] 102  >  59284 [PSH, ACK] Seq=877 Ack=1348 Win=8192 Len=22"
"346","2.449052","192.168.5.62","192.168.5.63","S7COMM","85","ROSCTR:[Job     ] Function:[Read Var]"
"347","2.449054","192.168.5.62","192.168.5.63","TCP","85","[TCP Retransmission] 59284  >  102 [PSH, ACK] Seq=1348 Ack=899 Win=8192 Len=31"
"348","2.455529","192.168.5.63","192.168.5.62","S7COMM","83","ROSCTR:[Ack_Data] Function:[Read Var]"
"349","2.455530","192.168.5.63","192.168.5.62","TCP","83","[TCP Retransmission] 102  >  59284 [PSH, ACK] Seq=899 Ack=1379 Win=8192 Len=29"
"350","2.476367","192.168.5.65","192.168.5.68","S7COMM-PLUS","123"," > 33491 Ver:[V3] [Notification] ObjId=DynObjX7.64.2 Ctick=166 NSeq=1108901 ChngCnt=1"
"351","2.476368","192.168.5.65","192.168.5.68","TCP","123","[TCP Retransmission] 102  >  33491 [PSH, ACK] Seq=166 Ack=1 Win=8192 Len=69"
"352","2.476578","192.168.5.68","192.168.5.65","TCP","60","33491  >  102 [ACK] Seq=1 Ack=235 Win=2920 Len=0"
"353","2.476578","192.168.5.68","192.168.5.65","TCP","60","[TCP Dup ACK 352#1] 33491  >  102 [ACK] Seq=1 Ack=235 Win=2920 Len=0"
"354","2.483539","192.168.5.68","192.168.5.65","S7COMM-PLUS","159","â†\22033491 Ver:[V3] Seq=56173 [Req SetVariable] ObjId=DynObjX7.64.2"
"355","2.483540","192.168.5.68","192.168.5.65","TCP","159","[TCP Retransmission] 33491  >  102 [PSH, ACK] Seq=1 Ack=235 Win=2920 Len=105"
"356","2.499013","192.168.5.62","192.168.5.63","S7COMM","93","ROSCTR:[Job     ] Function:[Write Var]"
"357","2.499013","192.168.5.62","192.168.5.63","TCP","93","[TCP Retransmission] 59284  >  102 [PSH, ACK] Seq=1379 Ack=928 Win=8192 Len=39"
