"No.","Time","Source","Destination","Protocol","Length","Info"
"1","0.000000","192.168.5.62","192.168.5.63","S7COMM","93","ROSCTR:[Job     ] Function:[Write Var]"
"2","0.000001","192.168.5.62","192.168.5.63","TCP","93","[TCP Retransmission] 59284  >  102 [PSH, ACK] Seq=1 Ack=1 Win=8192 Len=39"
"3","0.007306","192.168.5.63","192.168.5.62","S7COMM","76","ROSCTR:[Ack_Data] Function:[Write Var]"
"4","0.007307","192.168.5.63","192.168.5.62","TCP","76","[TCP Retransmission] 102  >  59284 [PSH, ACK] Seq=1 Ack=40 Win=8192 Len=22"
"5","0.099054","192.168.5.62","192.168.5.63","S7COMM","93","ROSCTR:[Job     ] Function:[Write Var]"
"6","0.099056","192.168.5.62","192.168.5.63","TCP","93","[TCP Retransmission] 59284  >  102 [PSH, ACK] Seq=40 Ack=23 Win=8192 Len=39"
"7","0.106339","192.168.5.63","192.168.5.62","S7COMM","76","ROSCTR:[Ack_Data] Function:[Write Var]"
"8","0.106341","192.168.5.63","192.168.5.62","TCP","76","[TCP Retransmission] 102  >  59284 [PSH, ACK] Seq=23 Ack=79 Win=8192 Len=22"
"9","0.142137","192.168.5.66","192.168.5.68","S7COMM-PLUS","81"," > 54765 Ver:[Ext. Keep Alive] ConfirmedBytes=39108180"
"10","0.142138","192.168.5.66","192.168.5.68","TCP","81","[TCP Retransmission] 102  >  54765 [PSH, ACK] Seq=1 Ack=1 Win=8192 Len=27"
"11","0.148758","192.168.5.62","192.168.5.63","S7COMM","85","ROSCTR:[Job     ] Function:[Read Var]"
"12","0.148759","192.168.5.62","192.168.5.63","TCP","85","[TCP Retransmission] 59284  >  102 [PSH, ACK] Seq=79 Ack=45 Win=8192 Len=31"
"13","0.156377","192.168.5.63","192.168.5.62","S7COMM","83","ROSCTR:[Ack_Data] Function:[Read Var]"
"14","0.156377","192.168.5.63","192.168.5.62","TCP","83","[TCP Retransmission] 102  >  59284 [PSH, ACK] Seq=45 Ack=110 Win=8192 Len=29"
"15","0.179417","192.168.5.65","192.168.5.68","S7COMM-PLUS","123"," > 33491 Ver:[V3] [Notification] ObjId=DynObjX7.64.2 Ctick=1 NSeq=1107968 ChngCnt=1"
"16","0.179418","192.168.5.65","192.168.5.68","TCP","123","[TCP Retransmission] 102  >  33491 [PSH, ACK] Seq=1 Ack=1 Win=8192 Len=69"
"17","0.179615","192.168.5.68","192.168.5.65","TCP","60","33491  >  102 [ACK] Seq=1 Ack=70 Win=2920 Len=0"
"18","0.179615","192.168.5.68","192.168.5.65","TCP","60","[TCP Dup ACK 17#1] 33491  >  102 [ACK] Seq=1 Ack=70 Win=2920 Len=0"
"19","0.180120","192.168.5.68","192.168.5.66","TCP","60","54765  >  102 [ACK] Seq=1 Ack=28 Win=2920 Len=0"
"20","0.180121","192.168.5.68","192.168.5.66","TCP","60","[TCP Dup ACK 19#1] 54765  >  102 [ACK] Seq=1 Ack=28 Win=2920 Len=0"
"21","0.180383","192.168.5.93","192.168.5.101","UDP","1279","3389  >  51844 Len=1237"
"22","0.182248","192.168.5.93","192.168.5.101","UDP","190","3389  >  51844 Len=148"
"23","0.182744","192.168.5.93","192.168.5.101","UDP","1279","3389  >  51844 Len=1237"
"24","0.183875","192.168.5.93","192.168.5.101","UDP","190","3389  >  51844 Len=148"
"25","0.186472","192.168.5.68","192.168.5.65","S7COMM-PLUS","159","â†\22033491 Ver:[V3] Seq=55815 [Req SetVariable] ObjId=DynObjX7.64.2"
"26","0.186482","192.168.5.68","192.168.5.65","TCP","159","[TCP Retransmission] 33491  >  102 [PSH, ACK] Seq=1 Ack=70 Win=2920 Len=105"
"27","0.200801","192.168.5.62","192.168.5.63","S7COMM","93","ROSCTR:[Job     ] Function:[Write Var]"
"28","0.200802","192.168.5.62","192.168.5.63","TCP","93","[TCP Retransmission] 59284  >  102 [PSH, ACK] Seq=110 Ack=74 Win=8192 Len=39"
"29","0.210675","192.168.5.63","192.168.5.62","S7COMM","76","ROSCTR:[Ack_Data] Function:[Write Var]"
"30","0.210695","192.168.5.63","192.168.5.62","TCP","76","[TCP Retransmission] 102  >  59284 [PSH, ACK] Seq=74 Ack=149 Win=8192 Len=22"
"31","0.253672","192.168.5.101","192.168.5.93","TLSv1.2","97","Application Data"
"32","0.253674","192.168.5.101","192.168.5.93","TCP","97","[TCP Retransmission] 62762  >  3389 [PSH, ACK] Seq=1 Ack=1 Win=8211 Len=43"
"33","0.253772","192.168.5.93","192.168.5.101","TCP","66","3389  >  62762 [ACK] Seq=1 Ack=44 Win=62691 Len=0 SLE=1 SRE=44"
"34","0.254058","192.168.5.93","192.168.5.101","TCP","66","[TCP Dup ACK 33#1] 3389  >  62762 [ACK] Seq=1 Ack=44 Win=62691 Len=0 SLE=1 SRE=44"
"35","0.255125","192.168.5.93","192.168.5.101","UDP","196","3389  >  51844 Len=154"
"36","0.255707","192.168.5.93","192.168.5.101","UDP","196","3389  >  51844 Len=154"
"37","0.285345","192.168.5.68","192.168.5.65","S7COMM-PLUS","175","â†\22033491 Ver:[V3] Seq=55816 [Req GetMultiVariables]"
"38","0.285355","192.168.5.68","192.168.5.65","TCP","175","[TCP Retransmission] 33491  >  102 [PSH, ACK] Seq=106 Ack=70 Win=2920 Len=121"
"39","0.285355","192.168.5.65","192.168.5.68","TCP","60","102  >  33491 [ACK] Seq=70 Ack=227 Win=8071 Len=0"
"40","0.285356","192.168.5.65","192.168.5.68","TCP","60","[TCP Dup ACK 39#1] 102  >  33491 [ACK] Seq=70 Ack=227 Win=8071 Len=0"
"41","0.290609","192.168.5.65","192.168.5.68","S7COMM-PLUS","135"," > 33491 Ver:[V3] Seq=55816 [Res GetMultiVariables] Retval=OK"
"42","0.290611","192.168.5.65","192.168.5.68","TCP","135","[TCP Retransmission] 102  >  33491 [PSH, ACK] Seq=70 Ack=227 Win=8192 Len=81"
"43","0.299900","192.168.5.62","192.168.5.63","S7COMM","93","ROSCTR:[Job     ] Function:[Write Var]"
"44","0.299901","192.168.5.62","192.168.5.63","TCP","93","[TCP Retransmission] 59284  >  102 [PSH, ACK] Seq=149 Ack=96 Win=8192 Len=39"
"45","0.308324","192.168.5.63","192.168.5.62","S7COMM","76","ROSCTR:[Ack_Data] Function:[Write Var]"
"46","0.308325","192.168.5.63","192.168.5.62","TCP","76","[TCP Retransmission] 102  >  59284 [PSH, ACK] Seq=96 Ack=188 Win=8192 Len=22"
"47","0.327547","PcsCompu_ec:6a:77","LLDP_Multicast","LLDP","158","LA/desktop-46lsrhc LA/port-001 20 SysN=DESKTOP-46LSRHC SysD=innotek GmbH VirtualBox,1.2,0 RTClass3 Port Status = OFF"
"48","0.328264","192.168.5.68","192.168.5.65","TCP","60","33491  >  102 [ACK] Seq=227 Ack=151 Win=2920 Len=0"
"49","0.328265","192.168.5.68","192.168.5.65","TCP","60","[TCP Dup ACK 48#1] 33491  >  102 [ACK] Seq=227 Ack=151 Win=2920 Len=0"
"50","0.343640","192.168.5.101","192.168.5.93","UDP","60","51844  >  3389 Len=12"
"51","0.343641","192.168.5.101","192.168.5.93","UDP","60","51844  >  3389 Len=12"
"52","0.349832","192.168.5.62","192.168.5.63","S7COMM","85","ROSCTR:[Job     ] Function:[Read Var]"
"53","0.349833","192.168.5.62","192.168.5.63","TCP","85","[TCP Retransmission] 59284  >  102 [PSH, ACK] Seq=188 Ack=118 Win=8192 Len=31"
"54","0.356324","192.168.5.63","192.168.5.62","S7COMM","83","ROSCTR:[Ack_Data] Function:[Read Var]"
"55","0.356325","192.168.5.63","192.168.5.62","TCP","83","[TCP Retransmission] 102  >  59284 [PSH, ACK] Seq=118 Ack=219 Win=8192 Len=29"
"56","0.365214","192.168.5.64","192.168.5.68","S7COMM-PLUS","123"," > 43515 Ver:[V3] [Notification] ObjId=DynObjX7.64.119 Ctick=137 NSeq=406664 ChngCnt=1"
"57","0.365225","192.168.5.64","192.168.5.68","TCP","123","[TCP Retransmission] 102  >  43515 [PSH, ACK] Seq=1 Ack=1 Win=8192 Len=69"
"58","0.365234","192.168.5.68","192.168.5.64","TCP","60","43515  >  102 [ACK] Seq=1 Ack=70 Win=2920 Len=0"
"59","0.365235","192.168.5.68","192.168.5.64","TCP","60","[TCP Dup ACK 58#1] 43515  >  102 [ACK] Seq=1 Ack=70 Win=2920 Len=0"
"60","0.378945","192.168.5.68","192.168.5.64","S7COMM-PLUS","159","â†\22043515 Ver:[V3] Seq=55790 [Req SetVariable] ObjId=DynObjX7.64.119"
"61","0.378946","192.168.5.68","192.168.5.64","TCP","159","[TCP Retransmission] 43515  >  102 [PSH, ACK] Seq=1 Ack=70 Win=2920 Len=105"
"62","0.398794","192.168.5.62","192.168.5.63","S7COMM","93","ROSCTR:[Job     ] Function:[Write Var]"
"63","0.398795","192.168.5.62","192.168.5.63","TCP","93","[TCP Retransmission] 59284  >  102 [PSH, ACK] Seq=219 Ack=147 Win=8192 Len=39"
"64","0.406328","192.168.5.63","192.168.5.62","S7COMM","76","ROSCTR:[Ack_Data] Function:[Write Var]"
"65","0.406330","192.168.5.63","192.168.5.62","TCP","76","[TCP Retransmission] 102  >  59284 [PSH, ACK] Seq=147 Ack=258 Win=8192 Len=22"
"66","0.422790","192.168.5.64","192.168.5.68","TCP","60","102  >  43515 [ACK] Seq=70 Ack=106 Win=8192 Len=0"
"67","0.422791","192.168.5.64","192.168.5.68","TCP","60","[TCP Dup ACK 66#1] 102  >  43515 [ACK] Seq=70 Ack=106 Win=8192 Len=0"
"68","0.500852","192.168.5.62","192.168.5.63","S7COMM","93","ROSCTR:[Job     ] Function:[Write Var]"
"69","0.500853","192.168.5.62","192.168.5.63","TCP","93","[TCP Retransmission] 59284  >  102 [PSH, ACK] Seq=258 Ack=169 Win=8192 Len=39"
"70","0.511888","192.168.5.63","192.168.5.62","S7COMM","76","ROSCTR:[Ack_Data] Function:[Write Var]"
"71","0.511904","192.168.5.63","192.168.5.62","TCP","76","[TCP Retransmission] 102  >  59284 [PSH, ACK] Seq=169 Ack=297 Win=8192 Len=22"
"72","0.550866","192.168.5.62","192.168.5.63","S7COMM","85","ROSCTR:[Job     ] Function:[Read Var]"
"73","0.550868","192.168.5.62","192.168.5.63","TCP","85","[TCP Retransmission] 59284  >  102 [PSH, ACK] Seq=297 Ack=191 Win=8192 Len=31"
"74","0.561617","192.168.5.63","192.168.5.62","S7COMM","83","ROSCTR:[Ack_Data] Function:[Read Var]"
"75","0.561626","192.168.5.63","192.168.5.62","TCP","83","[TCP Retransmission] 102  >  59284 [PSH, ACK] Seq=191 Ack=328 Win=8192 Len=29"
"76","0.599920","192.168.5.62","192.168.5.63","S7COMM","93","ROSCTR:[Job     ] Function:[Write Var]"
"77","0.599921","192.168.5.62","192.168.5.63","TCP","93","[TCP Retransmission] 59284  >  102 [PSH, ACK] Seq=328 Ack=220 Win=8192 Len=39"
"78","0.608411","192.168.5.63","192.168.5.62","S7COMM","76","ROSCTR:[Ack_Data] Function:[Write Var]"
"79","0.608414","192.168.5.63","192.168.5.62","TCP","76","[TCP Retransmission] 102  >  59284 [PSH, ACK] Seq=220 Ack=367 Win=8192 Len=22"
"80","0.650955","192.168.5.68","192.168.5.66","S7COMM-PLUS","175","â†\22054765 Ver:[V3] Seq=55807 [Req GetMultiVariables]"
"81","0.650956","192.168.5.68","192.168.5.66","TCP","175","[TCP Retransmission] 54765  >  102 [PSH, ACK] Seq=1 Ack=28 Win=2920 Len=121"
"82","0.658349","192.168.5.66","192.168.5.68","S7COMM-PLUS","135"," > 54765 Ver:[V3] Seq=55807 [Res GetMultiVariables] Retval=OK"
"83","0.658357","192.168.5.68","192.168.5.66","TCP","60","54765  >  102 [ACK] Seq=122 Ack=109 Win=2920 Len=0"
"84","0.658358","192.168.5.68","192.168.5.66","TCP","60","[TCP Dup ACK 83#1] 54765  >  102 [ACK] Seq=122 Ack=109 Win=2920 Len=0"
"85","0.658417","192.168.5.66","192.168.5.68","S7COMM-PLUS","135","[TCP Spurious Retransmission]  |  > 54765 Ver:[V3] Seq=55807 [Res GetMultiVariables] Retval=OK"
"86","0.698833","192.168.5.62","192.168.5.63","S7COMM","93","ROSCTR:[Job     ] Function:[Write Var]"
"87","0.698834","192.168.5.62","192.168.5.63","TCP","93","[TCP Retransmission] 59284  >  102 [PSH, ACK] Seq=367 Ack=242 Win=8192 Len=39"
"88","0.708833","192.168.5.63","192.168.5.62","S7COMM","76","ROSCTR:[Ack_Data] Function:[Write Var]"
"89","0.708836","192.168.5.63","192.168.5.62","TCP","76","[TCP Retransmission] 102  >  59284 [PSH, ACK] Seq=242 Ack=406 Win=8192 Len=22"
"90","0.748862","192.168.5.62","192.168.5.63","S7COMM","85","ROSCTR:[Job     ] Function:[Read Var]"
"91","0.748863","192.168.5.62","192.168.5.63","TCP","85","[TCP Retransmission] 59284  >  102 [PSH, ACK] Seq=406 Ack=264 Win=8192 Len=31"
"92","0.755297","192.168.5.63","192.168.5.62","S7COMM","83","ROSCTR:[Ack_Data] Function:[Read Var]"
"93","0.755298","192.168.5.63","192.168.5.62","TCP","83","[TCP Retransmission] 102  >  59284 [PSH, ACK] Seq=264 Ack=437 Win=8192 Len=29"
"94","0.760757","Netgear_11:52:b3","All-RBridges","Slow Protocols","60","Subtype = 136"
"95","0.761104","Netgear_11:52:b3","All-RBridges","Slow Protocols","60","Subtype = 136"
"96","0.761237","Netgear_11:52:b3","All-RBridges","Slow Protocols","60","Subtype = 136"
"97","0.761537","Netgear_11:52:b3","All-RBridges","Slow Protocols","60","Subtype = 136"
"98","0.761812","Netgear_11:52:b3","All-RBridges","Slow Protocols","60","Subtype = 136"
"99","0.761964","Netgear_11:52:b3","All-RBridges","Slow Protocols","60","Subtype = 136"
"100","0.762107","Netgear_11:52:b3","All-RBridges","Slow Protocols","60","Subtype = 136"
"101","0.762244","Netgear_11:52:b3","All-RBridges","Slow Protocols","60","Subtype = 136"
"102","0.762389","Netgear_11:52:b3","All-RBridges","Slow Protocols","60","Subtype = 136"
"103","0.762548","Netgear_11:52:b3","All-RBridges","Slow Protocols","60","Subtype = 136"
"104","0.762837","Netgear_11:52:b3","All-RBridges","Slow Protocols","60","Subtype = 136"
"105","0.762984","Netgear_11:52:b3","All-RBridges","Slow Protocols","60","Subtype = 136"
"106","0.763122","Netgear_11:52:b3","All-RBridges","Slow Protocols","60","Subtype = 136"
"107","0.763276","Netgear_11:52:b3","All-RBridges","Slow Protocols","60","Subtype = 136"
"108","0.763420","Netgear_11:52:b3","All-RBridges","Slow Protocols","60","Subtype = 136"
"109","0.763726","Netgear_11:52:b3","All-RBridges","Slow Protocols","60","Subtype = 136"
"110","0.770116","192.168.5.66","192.168.5.68","S7COMM-PLUS","123"," > 54765 Ver:[V3] [Notification] ObjId=DynObjX7.64.2 Ctick=255 NSeq=1107966 ChngCnt=1"
"111","0.770117","192.168.5.66","192.168.5.68","TCP","123","[TCP Retransmission] 102  >  54765 [PSH, ACK] Seq=109 Ack=122 Win=8192 Len=69"
"112","0.770398","192.168.5.68","192.168.5.66","TCP","60","54765  >  102 [ACK] Seq=122 Ack=178 Win=2920 Len=0"
"113","0.770399","192.168.5.68","192.168.5.66","TCP","60","[TCP Dup ACK 112#1] 54765  >  102 [ACK] Seq=122 Ack=178 Win=2920 Len=0"
"114","0.798830","192.168.5.62","192.168.5.63","S7COMM","93","ROSCTR:[Job     ] Function:[Write Var]"
"115","0.798831","192.168.5.62","192.168.5.63","TCP","93","[TCP Retransmission] 59284  >  102 [PSH, ACK] Seq=437 Ack=293 Win=8192 Len=39"
"116","0.807623","192.168.5.63","192.168.5.62","S7COMM","76","ROSCTR:[Ack_Data] Function:[Write Var]"
"117","0.807629","192.168.5.63","192.168.5.62","TCP","76","[TCP Retransmission] 102  >  59284 [PSH, ACK] Seq=293 Ack=476 Win=8192 Len=22"
"118","0.824548","192.168.5.93","192.168.5.101","TLSv1.2","105","Application Data"
"119","0.825311","192.168.5.93","192.168.5.101","TCP","105","[TCP Retransmission] 3389  >  62762 [PSH, ACK] Seq=1 Ack=44 Win=62691 Len=51"
"120","0.825430","192.168.5.93","192.168.5.101","UDP","1279","3389  >  51844 Len=1237"
"121","0.825578","192.168.5.93","192.168.5.101","UDP","1279","3389  >  51844 Len=1237"
"122","0.825600","192.168.5.93","192.168.5.101","UDP","1279","3389  >  51844 Len=1237"
"123","0.825649","192.168.5.93","192.168.5.101","UDP","1279","3389  >  51844 Len=1237"
"124","0.825707","192.168.5.93","192.168.5.101","UDP","1279","3389  >  51844 Len=1237"
"125","0.825800","192.168.5.93","192.168.5.101","UDP","1279","3389  >  51844 Len=1237"
"126","0.825874","192.168.5.93","192.168.5.101","UDP","1279","3389  >  51844 Len=1237"
"127","0.825964","192.168.5.93","192.168.5.101","UDP","1282","3389  >  51844 Len=1240"
"128","0.826040","192.168.5.93","192.168.5.101","UDP","1279","3389  >  51844 Len=1237"
"129","0.826049","192.168.5.93","192.168.5.101","UDP","316","3389  >  51844 Len=274"
"130","0.826116","192.168.5.93","192.168.5.101","UDP","1282","3389  >  51844 Len=1240"
"131","0.826193","192.168.5.93","192.168.5.101","UDP","316","3389  >  51844 Len=274"
"132","0.839663","192.168.5.101","192.168.5.93","UDP","276","51844  >  3389 Len=234"
"133","0.839664","192.168.5.101","192.168.5.93","UDP","276","51844  >  3389 Len=234"
"134","0.851530","192.168.5.93","192.168.5.101","UDP","53","3389  >  51844 Len=11"
"135","0.851582","192.168.5.93","192.168.5.101","UDP","52","3389  >  51844 Len=10"
"136","0.851761","192.168.5.93","192.168.5.101","UDP","60","3389  >  51844 Len=11"
"137","0.851762","192.168.5.93","192.168.5.101","UDP","60","3389  >  51844 Len=10"
"138","0.866511","192.168.5.93","192.168.5.101","UDP","1279","3389  >  51844 Len=1237"
"139","0.866571","192.168.5.93","192.168.5.101","UDP","1279","3389  >  51844 Len=1237"
"140","0.866607","192.168.5.93","192.168.5.101","UDP","1257","3389  >  51844 Len=1215"
"141","0.866761","192.168.5.93","192.168.5.101","UDP","1279","3389  >  51844 Len=1237"
"142","0.866761","192.168.5.93","192.168.5.101","UDP","1279","3389  >  51844 Len=1237"
"143","0.866762","192.168.5.93","192.168.5.101","UDP","1257","3389  >  51844 Len=1215"
"144","0.872991","192.168.5.101","192.168.5.93","TCP","60","62762  >  3389 [ACK] Seq=44 Ack=52 Win=8211 Len=0"
"145","0.872992","192.168.5.101","192.168.5.93","TCP","60","[TCP Dup ACK 144#1] 62762  >  3389 [ACK] Seq=44 Ack=52 Win=8211 Len=0"
"146","0.900923","192.168.5.62","192.168.5.63","S7COMM","93","ROSCTR:[Job     ] Function:[Write Var]"
"147","0.900924","192.168.5.62","192.168.5.63","TCP","93","[TCP Retransmission] 59284  >  102 [PSH, ACK] Seq=476 Ack=315 Win=8192 Len=39"
"148","0.909988","192.168.5.63","192.168.5.62","S7COMM","76","ROSCTR:[Ack_Data] Function:[Write Var]"
"149","0.909989","192.168.5.63","192.168.5.62","TCP","76","[TCP Retransmission] 102  >  59284 [PSH, ACK] Seq=315 Ack=515 Win=8192 Len=22"
"150","0.936939","192.168.5.67","192.168.5.68","S7COMM-PLUS","123"," > 59899 Ver:[V3] [Notification] ObjId=DynObjX7.64.121 Ctick=254 NSeq=1107965 ChngCnt=1"
"151","0.936945","192.168.5.68","192.168.5.67","TCP","60","59899  >  102 [ACK] Seq=1 Ack=70 Win=2920 Len=0"
"152","0.936953","192.168.5.67","192.168.5.68","S7COMM-PLUS","123","[TCP Spurious Retransmission]  |  > 59899 Ver:[V3] [Notification] ObjId=DynObjX7.64.121 Ctick=254 NSeq=1107965 ChngCnt=1"
"153","0.936955","192.168.5.68","192.168.5.67","TCP","60","[TCP Dup ACK 151#1] 59899  >  102 [ACK] Seq=1 Ack=70 Win=2920 Len=0"
"154","0.942061","192.168.5.68","192.168.5.67","S7COMM-PLUS","159","â†\22059899 Ver:[V3] Seq=55795 [Req SetVariable] ObjId=DynObjX7.64.121"
"155","0.942062","192.168.5.68","192.168.5.67","TCP","159","[TCP Retransmission] 59899  >  102 [PSH, ACK] Seq=1 Ack=70 Win=2920 Len=105"
"156","0.949881","192.168.5.62","192.168.5.63","S7COMM","85","ROSCTR:[Job     ] Function:[Read Var]"
"157","0.949882","192.168.5.62","192.168.5.63","TCP","85","[TCP Retransmission] 59284  >  102 [PSH, ACK] Seq=515 Ack=337 Win=8192 Len=31"
"158","0.950152","192.168.5.67","192.168.5.68","TCP","60","102  >  59899 [ACK] Seq=70 Ack=106 Win=8192 Len=0"
"159","0.950153","192.168.5.67","192.168.5.68","TCP","60","[TCP Dup ACK 158#1] 102  >  59899 [ACK] Seq=70 Ack=106 Win=8192 Len=0"
"160","0.957296","192.168.5.63","192.168.5.62","S7COMM","83","ROSCTR:[Ack_Data] Function:[Read Var]"
"161","0.957297","192.168.5.63","192.168.5.62","TCP","83","[TCP Retransmission] 102  >  59284 [PSH, ACK] Seq=337 Ack=546 Win=8192 Len=29"
"162","0.973607","192.168.5.101","192.168.5.93","UDP","60","51844  >  3389 Len=12"
"163","0.973608","192.168.5.101","192.168.5.93","UDP","60","51844  >  3389 Len=12"
"164","0.999836","192.168.5.62","192.168.5.63","S7COMM","93","ROSCTR:[Job     ] Function:[Write Var]"
"165","0.999837","192.168.5.62","192.168.5.63","TCP","93","[TCP Retransmission] 59284  >  102 [PSH, ACK] Seq=546 Ack=366 Win=8192 Len=39"
"166","1.006597","Siemens_71:45:3c","LLDP_Multicast","PN-PTCP","60","DelayReq         , Seq=41333, Delay=          0ns, PortMAC=d4:f5:27:71:45:3c"
"167","1.006598","Siemens_71:45:3c","LLDP_Multicast","PN-PTCP","60","DelayReq         , Seq=41333, Delay=          0ns, PortMAC=d4:f5:27:71:45:3c"
"168","1.006598","Siemens_71:45:3c","LLDP_Multicast","PN-PTCP","60","DelayReq         , Seq=41333, Delay=          0ns, PortMAC=d4:f5:27:71:45:3c"
"169","1.007284","192.168.5.63","192.168.5.62","S7COMM","76","ROSCTR:[Ack_Data] Function:[Write Var]"
"170","1.007284","192.168.5.63","192.168.5.62","TCP","76","[TCP Retransmission] 102  >  59284 [PSH, ACK] Seq=366 Ack=585 Win=8192 Len=22"
"171","1.098917","192.168.5.62","192.168.5.63","S7COMM","93","ROSCTR:[Job     ] Function:[Write Var]"
"172","1.098918","192.168.5.62","192.168.5.63","TCP","93","[TCP Retransmission] 59284  >  102 [PSH, ACK] Seq=585 Ack=388 Win=8192 Len=39"
"173","1.106339","192.168.5.63","192.168.5.62","S7COMM","76","ROSCTR:[Ack_Data] Function:[Write Var]"
"174","1.106340","192.168.5.63","192.168.5.62","TCP","76","[TCP Retransmission] 102  >  59284 [PSH, ACK] Seq=388 Ack=624 Win=8192 Len=22"
"175","1.143973","192.168.5.68","192.168.5.67","S7COMM-PLUS","172","â†\22059899 Ver:[V3] Seq=55796 [Req GetMultiVariables]"
"176","1.143978","192.168.5.68","192.168.5.67","TCP","172","[TCP Retransmission] 59899  >  102 [PSH, ACK] Seq=106 Ack=70 Win=2920 Len=118"
"177","1.148863","192.168.5.62","192.168.5.63","S7COMM","85","ROSCTR:[Job     ] Function:[Read Var]"
"178","1.148864","192.168.5.62","192.168.5.63","TCP","85","[TCP Retransmission] 59284  >  102 [PSH, ACK] Seq=624 Ack=410 Win=8192 Len=31"
"179","1.149244","192.168.5.67","192.168.5.68","S7COMM-PLUS","135"," > 59899 Ver:[V3] Seq=55796 [Res GetMultiVariables] Retval=OK"
"180","1.149245","192.168.5.67","192.168.5.68","TCP","135","[TCP Retransmission] 102  >  59899 [PSH, ACK] Seq=70 Ack=224 Win=8192 Len=81"
"181","1.154281","192.168.5.63","192.168.5.62","S7COMM","83","ROSCTR:[Ack_Data] Function:[Read Var]"
"182","1.154281","192.168.5.63","192.168.5.62","TCP","83","[TCP Retransmission] 102  >  59284 [PSH, ACK] Seq=410 Ack=655 Win=8192 Len=29"
"183","1.179397","192.168.5.65","192.168.5.68","S7COMM-PLUS","123"," > 33491 Ver:[V3] [Notification] ObjId=DynObjX7.64.2 Ctick=2 NSeq=1107969 ChngCnt=1"
"184","1.179398","192.168.5.65","192.168.5.68","TCP","123","[TCP Retransmission] 102  >  33491 [PSH, ACK] Seq=151 Ack=227 Win=8192 Len=69"
"185","1.179696","192.168.5.68","192.168.5.65","TCP","60","33491  >  102 [ACK] Seq=227 Ack=220 Win=2920 Len=0"
"186","1.179697","192.168.5.68","192.168.5.65","TCP","60","[TCP Dup ACK 185#1] 33491  >  102 [ACK] Seq=227 Ack=220 Win=2920 Len=0"
"187","1.189172","192.168.5.68","192.168.5.67","TCP","60","59899  >  102 [ACK] Seq=224 Ack=151 Win=2920 Len=0"
"188","1.189196","192.168.5.68","192.168.5.67","TCP","60","[TCP Dup ACK 187#1] 59899  >  102 [ACK] Seq=224 Ack=151 Win=2920 Len=0"
"189","1.200850","192.168.5.62","192.168.5.63","S7COMM","93","ROSCTR:[Job     ] Function:[Write Var]"
"190","1.200850","192.168.5.62","192.168.5.63","TCP","93","[TCP Retransmission] 59284  >  102 [PSH, ACK] Seq=655 Ack=439 Win=8192 Len=39"
"191","1.210345","192.168.5.63","192.168.5.62","S7COMM","76","ROSCTR:[Ack_Data] Function:[Write Var]"
"192","1.210346","192.168.5.63","192.168.5.62","TCP","76","[TCP Retransmission] 102  >  59284 [PSH, ACK] Seq=439 Ack=694 Win=8192 Len=22"
"193","1.299898","192.168.5.62","192.168.5.63","S7COMM","93","ROSCTR:[Job     ] Function:[Write Var]"
"194","1.299899","192.168.5.62","192.168.5.63","TCP","93","[TCP Retransmission] 59284  >  102 [PSH, ACK] Seq=694 Ack=461 Win=8192 Len=39"
"195","1.308378","192.168.5.63","192.168.5.62","S7COMM","76","ROSCTR:[Ack_Data] Function:[Write Var]"
"196","1.308379","192.168.5.63","192.168.5.62","TCP","76","[TCP Retransmission] 102  >  59284 [PSH, ACK] Seq=461 Ack=733 Win=8192 Len=22"
"197","1.351473","192.168.5.62","192.168.5.63","S7COMM","85","ROSCTR:[Job     ] Function:[Read Var]"
"198","1.351489","192.168.5.62","192.168.5.63","TCP","85","[TCP Retransmission] 59284  >  102 [PSH, ACK] Seq=733 Ack=483 Win=8192 Len=31"
"199","1.356362","192.168.5.63","192.168.5.62","S7COMM","83","ROSCTR:[Ack_Data] Function:[Read Var]"
"200","1.356363","192.168.5.63","192.168.5.62","TCP","83","[TCP Retransmission] 102  >  59284 [PSH, ACK] Seq=483 Ack=764 Win=8192 Len=29"
"201","1.363738","192.168.5.64","192.168.5.68","S7COMM-PLUS","123"," > 43515 Ver:[V3] [Notification] ObjId=DynObjX7.64.119 Ctick=138 NSeq=406665 ChngCnt=1"
"202","1.363739","192.168.5.64","192.168.5.68","TCP","123","[TCP Retransmission] 102  >  43515 [PSH, ACK] Seq=70 Ack=106 Win=8192 Len=69"
"203","1.400555","192.168.5.62","192.168.5.63","S7COMM","93","ROSCTR:[Job     ] Function:[Write Var]"
"204","1.400570","192.168.5.62","192.168.5.63","TCP","93","[TCP Retransmission] 59284  >  102 [PSH, ACK] Seq=764 Ack=512 Win=8192 Len=39"
"205","1.401380","192.168.5.68","192.168.5.64","TCP","60","43515  >  102 [ACK] Seq=106 Ack=139 Win=2920 Len=0"
"206","1.401384","192.168.5.68","192.168.5.64","TCP","60","[TCP Dup ACK 205#1] 43515  >  102 [ACK] Seq=106 Ack=139 Win=2920 Len=0"
"207","1.406316","192.168.5.63","192.168.5.62","S7COMM","76","ROSCTR:[Ack_Data] Function:[Write Var]"
"208","1.406317","192.168.5.63","192.168.5.62","TCP","76","[TCP Retransmission] 102  >  59284 [PSH, ACK] Seq=512 Ack=803 Win=8192 Len=22"
"209","1.443325","192.168.5.93","192.168.5.101","UDP","1279","3389  >  51844 Len=1237"
"210","1.443521","192.168.5.93","192.168.5.101","UDP","1279","3389  >  51844 Len=1237"
"211","1.443577","192.168.5.93","192.168.5.101","UDP","1279","3389  >  51844 Len=1237"
"212","1.443654","192.168.5.93","192.168.5.101","UDP","1279","3389  >  51844 Len=1237"
"213","1.443712","192.168.5.93","192.168.5.101","UDP","1279","3389  >  51844 Len=1237"
"214","1.443715","192.168.5.93","192.168.5.101","UDP","1251","3389  >  51844 Len=1209"
"215","1.443850","192.168.5.93","192.168.5.101","UDP","1279","3389  >  51844 Len=1237"
"216","1.443851","192.168.5.93","192.168.5.101","UDP","1251","3389  >  51844 Len=1209"
"217","1.444277","192.168.5.93","192.168.5.101","UDP","1279","3389  >  51844 Len=1237"
"218","1.444346","192.168.5.93","192.168.5.101","UDP","1279","3389  >  51844 Len=1237"
"219","1.444408","192.168.5.93","192.168.5.101","UDP","717","3389  >  51844 Len=675"
"220","1.444416","192.168.5.93","192.168.5.101","UDP","1279","3389  >  51844 Len=1237"
"221","1.444597","192.168.5.93","192.168.5.101","UDP","1279","3389  >  51844 Len=1237"
"222","1.444598","192.168.5.93","192.168.5.101","UDP","717","3389  >  51844 Len=675"
"223","1.445904","192.168.5.93","192.168.5.101","UDP","1279","3389  >  51844 Len=1237"
"224","1.445964","192.168.5.93","192.168.5.101","UDP","1279","3389  >  51844 Len=1237"
"225","1.446094","192.168.5.93","192.168.5.101","UDP","1279","3389  >  51844 Len=1237"
"226","1.446152","192.168.5.93","192.168.5.101","UDP","1282","3389  >  51844 Len=1240"
"227","1.446154","192.168.5.93","192.168.5.101","UDP","1279","3389  >  51844 Len=1237"
"228","1.446225","192.168.5.93","192.168.5.101","UDP","1207","3389  >  51844 Len=1165"
"229","1.446281","192.168.5.93","192.168.5.101","UDP","1282","3389  >  51844 Len=1240"
"230","1.446397","192.168.5.93","192.168.5.101","UDP","1207","3389  >  51844 Len=1165"
"231","1.491341","192.168.5.67","192.168.5.68","S7COMM-PLUS","81"," > 59899 Ver:[Ext. Keep Alive] ConfirmedBytes=38941950"
"232","1.491343","192.168.5.67","192.168.5.68","TCP","81","[TCP Retransmission] 102  >  59899 [PSH, ACK] Seq=151 Ack=224 Win=8192 Len=27"
"233","1.491912","192.168.5.68","192.168.5.67","TCP","60","59899  >  102 [ACK] Seq=224 Ack=178 Win=2920 Len=0"
"234","1.491914","192.168.5.68","192.168.5.67","TCP","60","[TCP Dup ACK 233#1] 59899  >  102 [ACK] Seq=224 Ack=178 Win=2920 Len=0"
"235","1.500057","192.168.5.62","192.168.5.63","S7COMM","93","ROSCTR:[Job     ] Function:[Write Var]"
"236","1.500065","192.168.5.62","192.168.5.63","TCP","93","[TCP Retransmission] 59284  >  102 [PSH, ACK] Seq=803 Ack=534 Win=8192 Len=39"
"237","1.507369","192.168.5.63","192.168.5.62","S7COMM","76","ROSCTR:[Ack_Data] Function:[Write Var]"
"238","1.507370","192.168.5.63","192.168.5.62","TCP","76","[TCP Retransmission] 102  >  59284 [PSH, ACK] Seq=534 Ack=842 Win=8192 Len=22"
"239","1.551400","192.168.5.62","192.168.5.63","S7COMM","85","ROSCTR:[Job     ] Function:[Read Var]"
"240","1.551401","192.168.5.62","192.168.5.63","TCP","85","[TCP Retransmission] 59284  >  102 [PSH, ACK] Seq=842 Ack=556 Win=8192 Len=31"
"241","1.553618","192.168.5.101","192.168.5.93","UDP","62","51844  >  3389 Len=20"
"242","1.553619","192.168.5.101","192.168.5.93","UDP","62","51844  >  3389 Len=20"
"243","1.558329","192.168.5.63","192.168.5.62","S7COMM","83","ROSCTR:[Ack_Data] Function:[Read Var]"
"244","1.558330","192.168.5.63","192.168.5.62","TCP","83","[TCP Retransmission] 102  >  59284 [PSH, ACK] Seq=556 Ack=873 Win=8192 Len=29"
"245","1.600001","192.168.5.62","192.168.5.63","S7COMM","93","ROSCTR:[Job     ] Function:[Write Var]"
"246","1.600003","192.168.5.62","192.168.5.63","TCP","93","[TCP Retransmission] 59284  >  102 [PSH, ACK] Seq=873 Ack=585 Win=8192 Len=39"
"247","1.609319","192.168.5.63","192.168.5.62","S7COMM","76","ROSCTR:[Ack_Data] Function:[Write Var]"
"248","1.609320","192.168.5.63","192.168.5.62","TCP","76","[TCP Retransmission] 102  >  59284 [PSH, ACK] Seq=585 Ack=912 Win=8192 Len=22"
"249","1.699957","192.168.5.62","192.168.5.63","S7COMM","93","ROSCTR:[Job     ] Function:[Write Var]"
"250","1.699958","192.168.5.62","192.168.5.63","TCP","93","[TCP Retransmission] 59284  >  102 [PSH, ACK] Seq=912 Ack=607 Win=8192 Len=39"
"251","1.707397","192.168.5.63","192.168.5.62","S7COMM","76","ROSCTR:[Ack_Data] Function:[Write Var]"
"252","1.707398","192.168.5.63","192.168.5.62","TCP","76","[TCP Retransmission] 102  >  59284 [PSH, ACK] Seq=607 Ack=951 Win=8192 Len=22"
"253","1.748922","192.168.5.62","192.168.5.63","S7COMM","85","ROSCTR:[Job     ] Function:[Read Var]"
"254","1.748923","192.168.5.62","192.168.5.63","TCP","85","[TCP Retransmission] 59284  >  102 [PSH, ACK] Seq=951 Ack=629 Win=8192 Len=31"
"255","1.755390","192.168.5.63","192.168.5.62","S7COMM","83","ROSCTR:[Ack_Data] Function:[Read Var]"
"256","1.755392","192.168.5.63","192.168.5.62","TCP","83","[TCP Retransmission] 102  >  59284 [PSH, ACK] Seq=629 Ack=982 Win=8192 Len=29"
"257","1.770225","192.168.5.66","192.168.5.68","S7COMM-PLUS","123"," > 54765 Ver:[V3] [Notification] ObjId=DynObjX7.64.2 Ctick=0 NSeq=1107967 ChngCnt=1"
"258","1.770226","192.168.5.66","192.168.5.68","TCP","123","[TCP Retransmission] 102  >  54765 [PSH, ACK] Seq=178 Ack=122 Win=8192 Len=69"
"259","1.770462","192.168.5.68","192.168.5.66","TCP","60","54765  >  102 [ACK] Seq=122 Ack=247 Win=2920 Len=0"
"260","1.770462","192.168.5.68","192.168.5.66","TCP","60","[TCP Dup ACK 259#1] 54765  >  102 [ACK] Seq=122 Ack=247 Win=2920 Len=0"
"261","1.798818","192.168.5.62","192.168.5.63","S7COMM","93","ROSCTR:[Job     ] Function:[Write Var]"
"262","1.798819","192.168.5.62","192.168.5.63","TCP","93","[TCP Retransmission] 59284  >  102 [PSH, ACK] Seq=982 Ack=658 Win=8192 Len=39"
"263","1.808390","192.168.5.63","192.168.5.62","S7COMM","76","ROSCTR:[Ack_Data] Function:[Write Var]"
"264","1.808391","192.168.5.63","192.168.5.62","TCP","76","[TCP Retransmission] 102  >  59284 [PSH, ACK] Seq=658 Ack=1021 Win=8192 Len=22"
"265","1.822726","192.168.5.64","192.168.5.68","S7COMM-PLUS","81"," > 43515 Ver:[Ext. Keep Alive] ConfirmedBytes=14303009"
"266","1.822727","192.168.5.64","192.168.5.68","TCP","81","[TCP Retransmission] 102  >  43515 [PSH, ACK] Seq=139 Ack=106 Win=8192 Len=27"
"267","1.823000","192.168.5.68","192.168.5.64","TCP","60","43515  >  102 [ACK] Seq=106 Ack=166 Win=2920 Len=0"
"268","1.823001","192.168.5.68","192.168.5.64","TCP","60","[TCP Dup ACK 267#1] 43515  >  102 [ACK] Seq=106 Ack=166 Win=2920 Len=0"
"269","1.897934","192.168.5.62","192.168.5.63","S7COMM","93","ROSCTR:[Job     ] Function:[Write Var]"
"270","1.897935","192.168.5.62","192.168.5.63","TCP","93","[TCP Retransmission] 59284  >  102 [PSH, ACK] Seq=1021 Ack=680 Win=8192 Len=39"
"271","1.907412","192.168.5.63","192.168.5.62","S7COMM","76","ROSCTR:[Ack_Data] Function:[Write Var]"
"272","1.907413","192.168.5.63","192.168.5.62","TCP","76","[TCP Retransmission] 102  >  59284 [PSH, ACK] Seq=680 Ack=1060 Win=8192 Len=22"
"273","1.935372","192.168.5.67","192.168.5.68","S7COMM-PLUS","123"," > 59899 Ver:[V3] [Notification] ObjId=DynObjX7.64.121 Ctick=255 NSeq=1107966 ChngCnt=1"
"274","1.935374","192.168.5.67","192.168.5.68","TCP","123","[TCP Retransmission] 102  >  59899 [PSH, ACK] Seq=178 Ack=224 Win=8192 Len=69"
"275","1.935579","192.168.5.68","192.168.5.67","TCP","60","59899  >  102 [ACK] Seq=224 Ack=247 Win=2920 Len=0"
"276","1.935579","192.168.5.68","192.168.5.67","TCP","60","[TCP Dup ACK 275#1] 59899  >  102 [ACK] Seq=224 Ack=247 Win=2920 Len=0"
"277","1.949928","192.168.5.62","192.168.5.63","S7COMM","85","ROSCTR:[Job     ] Function:[Read Var]"
"278","1.949929","192.168.5.62","192.168.5.63","TCP","85","[TCP Retransmission] 59284  >  102 [PSH, ACK] Seq=1060 Ack=702 Win=8192 Len=31"
"279","1.957434","192.168.5.63","192.168.5.62","S7COMM","83","ROSCTR:[Ack_Data] Function:[Read Var]"
"280","1.957435","192.168.5.63","192.168.5.62","TCP","83","[TCP Retransmission] 102  >  59284 [PSH, ACK] Seq=702 Ack=1091 Win=8192 Len=29"
"281","1.999899","192.168.5.62","192.168.5.63","S7COMM","93","ROSCTR:[Job     ] Function:[Write Var]"
"282","1.999900","192.168.5.62","192.168.5.63","TCP","93","[TCP Retransmission] 59284  >  102 [PSH, ACK] Seq=1091 Ack=731 Win=8192 Len=39"
"283","2.008376","192.168.5.63","192.168.5.62","S7COMM","76","ROSCTR:[Ack_Data] Function:[Write Var]"
"284","2.008377","192.168.5.63","192.168.5.62","TCP","76","[TCP Retransmission] 102  >  59284 [PSH, ACK] Seq=731 Ack=1130 Win=8192 Len=22"
"285","2.099962","192.168.5.62","192.168.5.63","S7COMM","93","ROSCTR:[Job     ] Function:[Write Var]"
"286","2.099963","192.168.5.62","192.168.5.63","TCP","93","[TCP Retransmission] 59284  >  102 [PSH, ACK] Seq=1130 Ack=753 Win=8192 Len=39"
"287","2.109526","192.168.5.63","192.168.5.62","S7COMM","76","ROSCTR:[Ack_Data] Function:[Write Var]"
"288","2.109533","192.168.5.63","192.168.5.62","TCP","76","[TCP Retransmission] 102  >  59284 [PSH, ACK] Seq=753 Ack=1169 Win=8192 Len=22"
"289","2.148946","192.168.5.62","192.168.5.63","S7COMM","85","ROSCTR:[Job     ] Function:[Read Var]"
"290","2.148948","192.168.5.62","192.168.5.63","TCP","85","[TCP Retransmission] 59284  >  102 [PSH, ACK] Seq=1169 Ack=775 Win=8192 Len=31"
"291","2.157546","192.168.5.63","192.168.5.62","S7COMM","83","ROSCTR:[Ack_Data] Function:[Read Var]"
"292","2.157547","192.168.5.63","192.168.5.62","TCP","83","[TCP Retransmission] 102  >  59284 [PSH, ACK] Seq=775 Ack=1200 Win=8192 Len=29"
"293","2.180065","192.168.5.65","192.168.5.68","S7COMM-PLUS","123"," > 33491 Ver:[V3] [Notification] ObjId=DynObjX7.64.2 Ctick=3 NSeq=1107970 ChngCnt=1"
"294","2.180069","192.168.5.65","192.168.5.68","TCP","123","[TCP Retransmission] 102  >  33491 [PSH, ACK] Seq=220 Ack=227 Win=8192 Len=69"
"295","2.180074","192.168.5.68","192.168.5.65","TCP","60","33491  >  102 [ACK] Seq=227 Ack=289 Win=2920 Len=0"
"296","2.180078","192.168.5.68","192.168.5.65","TCP","60","[TCP Dup ACK 295#1] 33491  >  102 [ACK] Seq=227 Ack=289 Win=2920 Len=0"
"297","2.198917","192.168.5.62","192.168.5.63","S7COMM","93","ROSCTR:[Job     ] Function:[Write Var]"
"298","2.198918","192.168.5.62","192.168.5.63","TCP","93","[TCP Retransmission] 59284  >  102 [PSH, ACK] Seq=1200 Ack=804 Win=8192 Len=39"
"299","2.206770","Siemens_71:45:3c","LLDP_Multicast","PN-PTCP","60","DelayReq         , Seq=41334, Delay=          0ns, PortMAC=d4:f5:27:71:45:3c"
"300","2.206772","Siemens_71:45:3c","LLDP_Multicast","PN-PTCP","60","DelayReq         , Seq=41334, Delay=          0ns, PortMAC=d4:f5:27:71:45:3c"
"301","2.206772","Siemens_71:45:3c","LLDP_Multicast","PN-PTCP","60","DelayReq         , Seq=41334, Delay=          0ns, PortMAC=d4:f5:27:71:45:3c"
"302","2.207429","192.168.5.63","192.168.5.62","S7COMM","76","ROSCTR:[Ack_Data] Function:[Write Var]"
"303","2.207430","192.168.5.63","192.168.5.62","TCP","76","[TCP Retransmission] 102  >  59284 [PSH, ACK] Seq=804 Ack=1239 Win=8192 Len=22"
"304","2.213012","192.168.5.93","192.168.5.101","TLSv1.2","105","Application Data"
"305","2.213298","192.168.5.93","192.168.5.101","UDP","1279","3389  >  51844 Len=1237"
"306","2.213449","192.168.5.93","192.168.5.101","UDP","113","3389  >  51844 Len=71"
"307","2.213459","192.168.5.93","192.168.5.101","TCP","105","[TCP Retransmission] 3389  >  62762 [PSH, ACK] Seq=52 Ack=44 Win=62691 Len=51"
"308","2.213460","192.168.5.93","192.168.5.101","UDP","1279","3389  >  51844 Len=1237"
"309","2.213650","192.168.5.93","192.168.5.101","UDP","113","3389  >  51844 Len=71"
"310","2.231053","192.168.5.101","192.168.5.93","UDP","152","51844  >  3389 Len=110"
"311","2.231054","192.168.5.101","192.168.5.93","UDP","152","51844  >  3389 Len=110"
"312","2.246331","192.168.5.93","192.168.5.101","UDP","53","3389  >  51844 Len=11"
"313","2.246410","192.168.5.93","192.168.5.101","UDP","52","3389  >  51844 Len=10"
"314","2.246563","192.168.5.93","192.168.5.101","UDP","60","3389  >  51844 Len=11"
"315","2.246563","192.168.5.93","192.168.5.101","UDP","60","3389  >  51844 Len=10"
"316","2.248503","PcsCompu_7d:12:f6","LLDP_Multicast","LLDP","158","LA/desktop-46lsrhc LA/port-001 20 SysN=DESKTOP-46LSRHC SysD=innotek GmbH VirtualBox,1.2,0 RTClass3 Port Status = OFF"
"317","2.257814","192.168.5.93","192.168.5.101","UDP","1279","3389  >  51844 Len=1237"
"318","2.257885","192.168.5.93","192.168.5.101","UDP","746","3389  >  51844 Len=704"
"319","2.258126","192.168.5.93","192.168.5.101","UDP","1279","3389  >  51844 Len=1237"
"320","2.258127","192.168.5.93","192.168.5.101","UDP","746","3389  >  51844 Len=704"
"321","2.263026","192.168.5.101","192.168.5.93","TCP","60","62762  >  3389 [ACK] Seq=44 Ack=103 Win=8210 Len=0"
"322","2.263027","192.168.5.101","192.168.5.93","TCP","60","[TCP Dup ACK 321#1] 62762  >  3389 [ACK] Seq=44 Ack=103 Win=8210 Len=0"
"323","2.281709","192.168.5.93","192.168.5.101","UDP","1279","3389  >  51844 Len=1237"
"324","2.281778","192.168.5.93","192.168.5.101","UDP","1279","3389  >  51844 Len=1237"
"325","2.281807","192.168.5.93","192.168.5.101","UDP","300","3389  >  51844 Len=258"
"326","2.282047","192.168.5.93","192.168.5.101","UDP","1279","3389  >  51844 Len=1237"
"327","2.282048","192.168.5.93","192.168.5.101","UDP","1279","3389  >  51844 Len=1237"
"328","2.282049","192.168.5.93","192.168.5.101","UDP","300","3389  >  51844 Len=258"
"329","2.300958","192.168.5.62","192.168.5.63","S7COMM","93","ROSCTR:[Job     ] Function:[Write Var]"
"330","2.300959","192.168.5.62","192.168.5.63","TCP","93","[TCP Retransmission] 59284  >  102 [PSH, ACK] Seq=1239 Ack=826 Win=8192 Len=39"
"331","2.310001","192.168.5.63","192.168.5.62","S7COMM","76","ROSCTR:[Ack_Data] Function:[Write Var]"
"332","2.310002","192.168.5.63","192.168.5.62","TCP","76","[TCP Retransmission] 102  >  59284 [PSH, ACK] Seq=826 Ack=1278 Win=8192 Len=22"
"333","2.349940","192.168.5.62","192.168.5.63","S7COMM","85","ROSCTR:[Job     ] Function:[Read Var]"
"334","2.349941","192.168.5.62","192.168.5.63","TCP","85","[TCP Retransmission] 59284  >  102 [PSH, ACK] Seq=1278 Ack=848 Win=8192 Len=31"
"335","2.356386","192.168.5.63","192.168.5.62","S7COMM","83","ROSCTR:[Ack_Data] Function:[Read Var]"
"336","2.356388","192.168.5.63","192.168.5.62","TCP","83","[TCP Retransmission] 102  >  59284 [PSH, ACK] Seq=848 Ack=1309 Win=8192 Len=29"
"337","2.364029","192.168.5.64","192.168.5.68","S7COMM-PLUS","123"," > 43515 Ver:[V3] [Notification] ObjId=DynObjX7.64.119 Ctick=139 NSeq=406666 ChngCnt=1"
"338","2.364030","192.168.5.64","192.168.5.68","TCP","123","[TCP Retransmission] 102  >  43515 [PSH, ACK] Seq=166 Ack=106 Win=8192 Len=69"
"339","2.365304","192.168.5.68","192.168.5.64","TCP","60","43515  >  102 [ACK] Seq=106 Ack=235 Win=2920 Len=0"
"340","2.365305","192.168.5.68","192.168.5.64","TCP","60","[TCP Dup ACK 339#1] 43515  >  102 [ACK] Seq=106 Ack=235 Win=2920 Len=0"
"341","2.400293","192.168.5.62","192.168.5.63","S7COMM","93","ROSCTR:[Job     ] Function:[Write Var]"
"342","2.400294","192.168.5.62","192.168.5.63","TCP","93","[TCP Retransmission] 59284  >  102 [PSH, ACK] Seq=1309 Ack=877 Win=8192 Len=39"
"343","2.403554","192.168.5.101","192.168.5.93","UDP","60","51844  >  3389 Len=14"
"344","2.403555","192.168.5.101","192.168.5.93","UDP","60","51844  >  3389 Len=14"
"345","2.407815","192.168.5.63","192.168.5.62","S7COMM","76","ROSCTR:[Ack_Data] Function:[Write Var]"
"346","2.407821","192.168.5.63","192.168.5.62","TCP","76","[TCP Retransmission] 102  >  59284 [PSH, ACK] Seq=877 Ack=1348 Win=8192 Len=22"
"347","2.499320","192.168.5.62","192.168.5.63","S7COMM","93","ROSCTR:[Job     ] Function:[Write Var]"
